name	full_name	id	description	language	size	watchers	forks	stargazers_count
nektechTextEditor	NEKTech-Labs/nektechTextEditor	32737104	Text Editor Example using QT, C++ and QML	C++	148	4	3	4
e	eklitzke/e	3369197	A text editor.	Python	855	4	3	4
moodle-editor_atto	damyon/moodle-editor_atto	13764447	Atto text editor for Moodle	PHP	445	4	6	4
text-zipper	jtdaugherty/text-zipper	38845196	A text editor zipper libary	Haskell	26	4	4	4
elm-text-editor	wetmore/elm-text-editor	35472098	Simple modal text editor in Elm	Elm	176	4	1	4
collaborative-text-editor	mazubieta/collaborative-text-editor	2489446	UNO CSCI 4210 Software Engineering	Java	859	4	0	4
Lisp-Text-Editor	dradtke/Lisp-Text-Editor	3456096		Common Lisp	4364	4	0	4
Script-Text-Editor	xupefei/Script-Text-Editor	4421331		C#	524	4	0	4
KotlinTextEditor	chemickypes/KotlinTextEditor	58318775	Simple Text Editor developed using Kotlin programming language	Kotlin	218	4	0	4
textile_editor	remear/textile_editor	1084126		Ruby	125	4	1	4
atom-text-editor-exercise	atom/atom-text-editor-exercise	30626445	Exercise the atom-text-editor HTML in a pane item. Explore usage for packages	CoffeeScript	115	4	2	4
yi-language	yi-editor/yi-language	23301506	Collection of lexers used by the Yi text editor.	Haskell	98	4	8	4
tinymce	leanote/tinymce	43039706	Tinymce Rich Text Editor For Leanote http://leanote.org	JavaScript	2413	4	6	4
LetterBrush	incompl/LetterBrush	2357995	Text editor for drawing, not typing.	JavaScript	218	4	3	4
jSecureEdit	mrclay/jSecureEdit	1639317	Java desktop encrypted text editor (crude proof-of-concept)	Java	180	4	8	4
ePad	JeffHoogland/ePad	17792579	A simple text editor written in python and elementary	Python	282	4	7	4
NotePad	edward344/NotePad	31078345	A simple text editor for python	Python	20	4	4	4
xkcd-comics	peduxe/xkcd-comics	39559233	View xkcd comics from Atom text editor	JavaScript	20	4	6	4
ace.modx	manse/ace.modx	6168866	Add a rich text editor ACE for MODX Evo.	JavaScript	705	4	4	4
steno	NdYAG/steno	41618153	Rich Text Editor	JavaScript	182	4	1	4
TypeAhead	alvinj/TypeAhead	19464344	A type-ahead, predictive text editor, written in Java	Java	388	4	8	4
scribe	jmacdonald/scribe	29223054	Text editor components	Rust	193	4	0	4
NimKate	PhilipWitte/NimKate	20345203	Nimrod programming language support for Kate text editor.	JavaScript	260	4	3	4
AutoHotkey-Editors	ahkscript/AutoHotkey-Editors	30263504	AutoHotkey Syntax Highlighting for text editors	AutoHotkey	162	4	2	4
Flex-4-Rich-Text-Editor	tzehon/Flex-4-Rich-Text-Editor	2048305		JavaScript	6604	4	0	4
TheWindWaker_Text_Editor	Sage-of-Mirrors/TheWindWaker_Text_Editor	45942644	A text and font color editor for The Legend of Zelda: The Wind Waker written by Sage of Mirrors/Gamma.	C#	40	4	0	4
atom-text-editor-useful-packages	ozluy/atom-text-editor-useful-packages	54623818	some useful atom text editor packages 	null	2	4	1	4
atom-opencl	podgib/atom-opencl	18837114	OpenCL language support for Atom text editor	CoffeeScript	36	4	2	4
PyEdit	AwwCookies/PyEdit	11921191	A really basic python text editor with syntax highlighting	Python	90	4	2	4
migzing	devmaestro/migzing	25525352	Android Rich Text Editor	Java	3392	4	0	4
delimit	Kazade/delimit	17509416	An opinionated text editor	C++	513	4	1	4
sublime-iRules	billchurch/sublime-iRules	19616418	iRules Syntax Highlighting for Sublime Text Editor http://www.sublimetext.com	JavaScript	155	4	3	4
atom-rivescript	aichaos/atom-rivescript	46758321	Syntax highlighting for RiveScript in the Atom text editor.	CoffeeScript	70	4	3	4
oneteam-rte	oneteam-dev/oneteam-rte	56668458	Oneteam Rich text editor	JavaScript	164	4	0	4
cleditor-angularjs	victorca/cleditor-angularjs	16957189	Angularjs Directive to work with the jquery plugin CLEditor to rich text editor.	null	356	4	4	4
Sublime-Text-DocBook-XML-Snippets	ddri/Sublime-Text-DocBook-XML-Snippets	3990693	A collection of DocBook XML snippets for the Sublime Text editor. 	JavaScript	753	4	3	4
notes	davsket/notes	3184326	ultra basic text editor	JavaScript	2620	4	0	4
SuperpowersHTML5_TextEditorTheme_IVYSAUR	StuffBySpencer/SuperpowersHTML5_TextEditorTheme_IVYSAUR	51691398	A simple dark color-theme for the SuperpowersHTML5 game engine text editor	CSS	8	4	0	4
fxite	yetanothergeek/fxite	1037163	The Free Extensible Text Editor	C++	5655	4	1	4
SpiffGtkWidgets	knipknap/SpiffGtkWidgets	1064910	A collection of GTK widgets, including a calendar and a text editor	Python	420	4	2	4
nemo	karamfd/nemo	40766473	Dark Theme For Brackets Text Editor	CSS	1799	4	0	4
Transcriptions	soleil-alpin/Transcriptions	51823266	A rtf-text editor optimized for fast manual transcription of audio- or video material on the Mac.	Objective-C	3871	4	4	4
ajure	onlyafly/ajure	2630326	Programmers' text editor in Clojure	Clojure	26648	4	0	4
cmsplugin-simple-gallery	chmeliuk/cmsplugin-simple-gallery	4106221	Simple gallery plugin for django cms. enabled in text editor.	Python	101	4	2	4
dred	dr-soft/dred	63646546	A fast, ultra lightweight text editor.	C	2313	4	0	4
atom-printer	postcasio/atom-printer	30940363	Print from the Atom text editor	CoffeeScript	144	4	4	4
justinemacs	jart/justinemacs	3106213	My emacs24 text editor configuration	Emacs Lisp	291	4	1	4
jshint.chocmixin	derekr/jshint.chocmixin	5581178	A mixin for the Chocolat text editor that provides jshint features.	JavaScript	241	4	2	4
komodo-morekomodo	dafizilla/komodo-morekomodo	2547197	MoreKomodo adds some features useful for text editor users and developers.	JavaScript	291	4	2	4
themegen	atg/themegen	914108	A text editor theme generator	JavaScript	1080	4	0	4
mad	aktowns/mad	30137531	a ruby based terminal text editor	Ruby	1860	4	0	4
gutenborg	gcr/gutenborg	103762	Web-based collaborative text editor	JavaScript	652	4	0	4
Soroban	RyanBurnside/Soroban	27911090	A simple soroban (Japanese abacus) for your Emacs text editor	Emacs Lisp	160	4	0	4
as3rte	myjerry/as3rte	2004609	Rich text editor for Adobe AIR applications	ActionScript	120	4	0	4
Jail	JAChapmanII/Jail	1493394	A "for learning" keymap-able text editor inspired by vim	C++	4139	4	0	4
cknw-editor	insolite/cknw-editor	14509020	node-webkit + CKEditor based WYSIWYG specialized text editor	JavaScript	66172	4	1	4
wxEditor	mengqvist/wxEditor	13258163	A barebones gui text editor. Written in python, using wxWidgets.	Python	204	4	1	4
tide-sublime	wass3r/tide-sublime	7515757	TideSDK API autocompletion for Sublime Text editor	null	147	4	1	4
FwText	joaoneto/FwText	7523695	DEPRECATED DON'T USE - Free WYSIWYG text editor jQuery Plugin.	JavaScript	276	4	1	4
alignequals.chocmixin	inadarei/alignequals.chocmixin	16246616	Equal Sign Aligner Mixin for Chocolat Text Editor	null	152	4	0	4
gogala	gophergala/gogala	29736832	An online text editor with chat and multi user features - don't ask why the repo is tagged as JavaScript ?¿ 	JavaScript	2872	4	3	4
hellfire	odkq/hellfire	6849649	text editor for the terminal written in python, with 2048!	Python	452	4	0	4
xvi	martinwguy/xvi	9187966	xvi, a portable multi-file text editor	C	4498	4	0	4
rich-text-area	seanhess/rich-text-area	62965	A refactor of Flex's Rich Text Editor	ActionScript	88	4	1	4
dockerletion	wingyplus/dockerletion	41243341	A autocompletion docker instructions for Atom text editor	CoffeeScript	3	4	0	4
HTML5Canvas.sugar	emin/HTML5Canvas.sugar	3843080	HTML5 Canvas sugar for Espresso Text Editor	null	108	4	0	4
chocolat-solarized	kenips/chocolat-solarized	2743817	Solarized theme for Fileability's Chocolat text editor	null	88	4	0	4
codemirror-element	dartlab/codemirror-element	30127746	Polymer element wrapping the CodeMirror text editor.	Dart	1944	4	1	4
wrote-old	hf/wrote-old	3148788	Minimal text editor that lets you just write.	Vala	4225	4	1	4
codex	ccbrown/codex	19752016	A light-weight programmer's text editor.	Objective-C	1992	4	1	4
AkelPad_coder	Infocatcher/AkelPad_coder	5714914	Syntax themes for AkelPad text editor with Coder plugin	HTML	468	4	0	4
megadraft-related-articles-plugin	globocom/megadraft-related-articles-plugin	62244171	Related articles plugin for Megadraft text editor	JavaScript	25	4	0	4
vue-gdrive	tralves/vue-gdrive	64715345	VueJS text editor with Google Drive integration	JavaScript	2812	4	0	4
ExCo	matkuki/ExCo	46371518	Extensible GUI text editor written in Python	Python	1799	4	0	4
FullscreenWriter	reinerspass/FullscreenWriter	2169256	Really simple fullscreen text editor like all the other very simple text editors with fullscreen support. But it is free!	C	27952	4	0	4
love-edit	finnoleary/love-edit	24407615	A modular text editor in Love2D/lua. /Fully/ (Emacs level) programmable with lua.	Lua	652	4	0	4
NoteLiner	NathanLaan/NoteLiner	8472627	Windows based text editor that uses a kind of outliner style of editing.	C#	2796	4	0	4
mimsy	jesse99/mimsy	7104057	Mac OS X text editor that doubles as a light-weight IDE.	Objective-C	1994	4	0	4
atom-xml-tools	DotJoshJohnson/atom-xml-tools	34765562	A collection of essential XML utilities for the Atom text editor.	CoffeeScript	164	4	1	4
scratchedit	LouCypher/scratchedit	5235926	Scratchpad Editor - Enables you to use external text editor with Firefox Scratchpad.	JavaScript	256	4	0	4
mephisto_tinymce	carter/mephisto_tinymce	55646	Adds TinyMCE WYSIWYG rich text editor to Mephisto Article Edit Page	Ruby	315	4	1	4
bpy_externall	zeffii/bpy_externall	46135048	execute scripts in a running Blender session from any decent text editor.	Python	28	4	1	4
pinned-tabs-for-atom	ericcornelissen/pinned-tabs-for-atom	48334489	A package for the Atom text editor that allows you to pin tabs.	CoffeeScript	480	4	1	4
gedit_gherkin	teacup-on-rockingchair/gedit_gherkin	981434	Cucumber's Gherkin syntax for the gEdit text editor and any other gtksourceview based editor	Ruby	216	4	0	4
textor	Houfeng/textor	16473884	This is a very cool text editor, not a IDE, Only 3s to start using.	HTML	4768	4	1	4
brackets-codecademy-theme	unsyllable/brackets-codecademy-theme	46902178	Theme inspired and created for Brackets.io "a popular open source text-editor" by Adobe.	CSS	1181	4	0	4
django-richtextfield	jaap3/django-richtextfield	24059681	A Django model field and widget that renders a customizable WYSIWYG/rich text editor	Python	49	4	1	4
lestle-theme-collection	lewislepton/lestle-theme-collection	48449020	collection of my theme [for different text editor/IDE] i use in day to day life	CSS	1350	4	0	4
jQuery-RTE	kamranayub/jQuery-RTE	1253249	Modified version of Batiste Bieler's rich text editor plugin. Super lightweight and modified to work with ASP.NET Web Forms.	JavaScript	116	4	1	4
Live-CSS-Mod	individuo7/Live-CSS-Mod	3527015	Chrome Extension that modify the HTML/CSS/JS code from your favorite text editor and it'll automatically refresh your web browser to see the changes.	JavaScript	215	4	0	4
ListPad	jashp/ListPad	5322060	An open-source text editor for Android where lines can be easily added, deleted, reordered and modified. Features include browsing the file-system, bookmarking files and managing recent files. A couple thousand downloads and 4+ stars on Google Play.	Java	780	4	0	4
TextEditor	jamesguoxin/TextEditor	47975543	Coursera Java Specialisation Project Two	Java	2171	3	5	3
TextEditor	surajgautam/TextEditor	61993835	null	Java	27	3	3	3
kissy-editor	hotoo/kissy-editor	887870	KISSY Rich-Text Editor	JavaScript	1724	3	8	3
Zawgyi-Web-Text-Editor	saturngod/Zawgyi-Web-Text-Editor	3784546	webtexteditor zawgyi version	JavaScript	976	3	3	3
TextEditor-Qt	dareTake/TextEditor-Qt	4429168	texteditor using Qt	C++	99	3	2	3
editor	tomsmeding/editor	48890112	My own text editor	C++	102	3	5	3
TextEditor	Luckygirlllll/TextEditor	45940812	This is very cool TextEditor	Java	2762	3	0	3
TextEditor	d-kami/TextEditor	1820470	My TextEditor for Android	Java	104	3	0	3
TextEditor	mparker11/TextEditor	1837586	Simple text editor 	C#	120	3	0	3
vx	philipdexter/vx	43694734	a text editor	Python	238	3	2	3
lwe	TheTomster/lwe	28947811	a cursorless text editor	C	211	3	2	3
RichTextEditor	IainDelaney/RichTextEditor	10746512	Rich Text Editor using webkit based on http://http://ios-blog.co.uk/tutorials/rich-text-editing-a-simple-start-part-1/	Objective-C	136	3	0	3
JotaTextEditor	jiro-aqua/JotaTextEditor	44470158	Text Editor for Android	Java	28084	3	1	3
simple-text-editor	hun7err/simple-text-editor	7342194	A simple text editor with syntax highlighting written in Java	Java	12576	3	1	3
encrypted-text-editor	CaptEmulation/encrypted-text-editor	18716379	Qt/Crypto++ encrypted text editor example	C++	852	3	0	3
richTextEditor	andrewtdunn/richTextEditor	9799707	In-browser rich-text editor which compiles to svg	JavaScript	2348	3	0	3
svg-text-editor	tomaash/svg-text-editor	27595070	Angular based text editor for SVG with forth-and-back conversion to contenteditable HTML	CSS	3560	3	1	3
Ocarina-Text-Editor	Sage-of-Mirrors/Ocarina-Text-Editor	57468616	A text editor for The Legend of Zelda: Ocarina of Time.	C#	1613	3	1	3
swing-texteditor	sheimi/swing-texteditor	3483210	a text editor implemented by swing	Java	208	3	3	3
puppet-macvim	boxen/puppet-macvim	6052692	MacVim is the text editor Vim for Mac OS X	Ruby	12	3	8	3
pi	ac7/pi	22320841	text editor	Go	360	3	0	3
mute-demo	coast-team/mute-demo	20092020	Multi-User Text Editor running on localhost	JavaScript	6013	3	6	3
mdiedit	selairi/mdiedit	19933970	Simple text editor with MDI interface	C++	84	3	2	3
jquery-rte	buntekuh/jquery-rte	214337	a lightweight rich text editor based upon jquery	JavaScript	84	3	3	3
SessionSaver	guillermo-carrasco/SessionSaver	4599071	Plugin to save sessions in Sublime text editor	Python	151	3	3	3
espada	cmpitg/espada	8313606	Espada the hackable text editor.	Ruby	875	3	2	3
lilypad	gperciva/lilypad	3422367	Lightweight text editors for GNU LilyPond	C	559	3	2	3
Text-Editor-in-Java	rejochandran/Text-Editor-in-Java	24447777	Text Editor in Java with syntax highlighting	Java	1041	3	0	3
new-new-Text-Editor	PiersonBro/new-new-Text-Editor	7311229	A simple UIKit based text-Editor for iPhone and iPad (partially working).	Objective-C	2154	3	1	3
XCImageAndTextEditor	jczmdeveloper/XCImageAndTextEditor	57289303	A Mix Picture And Text Editor-使用SpannableString And ImageSpan 实现的图文混排编辑器	Java	3835	3	1	3
XrmRichTextEditor	BackToTheCrm/XrmRichTextEditor	45839798		JavaScript	348	3	0	3
html5-text-editor	p-m-p/html5-text-editor	3290051	Text editor built with the FileSystem API	JavaScript	2024	3	0	3
150819_electron_text_editor	ics-creative/150819_electron_text_editor	40707767	「テキストエディターを作ってElectronの基礎を学ぼう！ HTML5でPCアプリ開発入門」で紹介したデモアプリです。	JavaScript	380	3	1	3
Teksperanto	nmquirk/Teksperanto	10077217	Esperanto text editor.	Java	1143	3	1	3
collaborative-editor	ozzimpact/collaborative-editor	32045514	Real-time room based collaborative rich text editor.	JavaScript	5155	3	2	3
txtedit	terev/txtedit	15402530	A Text Editor	Python	3582	3	1	3
knockout-froala	froala/knockout-froala	43287754	Knockout.js binding for Froala WYSIWYG HTML Rich Text Editor	HTML	22	3	3	3
KhtSimpleText	khertan/KhtSimpleText	3639766	A simple plain text editor for Harmattan	Python	2115	3	2	3
Apex	MarkChuCarroll/Apex	1559644	Apex text editor	Go	22732	3	0	3
plugins	txt2tags/plugins	18890659	Add txt2tags support to your favorite text editor, CMS, …	PHP	240	3	3	3
darcula-theme-various-ide	Sash0k/darcula-theme-various-ide	15803756	 Contains color themes like IntelliJ IDEA Darcula for various text editors.	null	176	3	3	3
FeatherPad	tsujan/FeatherPad	54059569	Lightweight Qt5 Plain-Text Editor for Linux	C++	234	3	2	3
solylace	madx/solylace	89048	A Shoes text editor	Ruby	108	3	0	3
tetextedit	OrdinaryMagician/tetextedit	6784587	te is a text editor	C	155	3	1	3
ckeditor-plugin	Shahiem/ckeditor-plugin	23856140	CKEditor is a ready-for-use HTML text editor designed to simplify web content creation. (This an OctoberCMS plugin)	JavaScript	6530	3	4	3
atom-remember-folds	forivall/atom-remember-folds	51549414	Remembers and automatically re-folds folds in your text editors in atom	JavaScript	6	3	2	3
cmacs	krockot/cmacs	11317962	Scriptable text editor for Chrome.	JavaScript	216	3	0	3
sed	gooselinux/sed	2004741	A GNU stream text editor	null	106	3	0	3
CodeEditor	Jerryno/CodeEditor	28981754	Blender Addon enhancing Text Editor	Python	124	3	0	3
todo-pt	hi5/todo-pt	17107343	Universal TODO lists for Text Editors (based on PlainTasks)	AutoHotkey	142	3	2	3
tcled	slebetman/tcled	17585079	Pure Tcl Console Text Editor	Tcl	213	3	0	3
rune-editor	dmliao/rune-editor	12988765	jRuby-Swing Text Editor.	Ruby	2748	3	0	3
reditor	duckinator/reditor	503381	text editor written in ruby	Ruby	112	3	0	3
tef	joshhartigan/tef	29387922	terminal-based text editor	JavaScript	124	3	0	3
rte-angular	drejkim/rte-angular	23034222	An AngularJS rich-text editor	JavaScript	22	3	0	3
WordPress-Editor-Common	wordpress-mobile/WordPress-Editor-Common	30357327	Common code of Android and iOS rich text editor component.	JavaScript	208	3	2	3
Thoth	Pent00/Thoth	4148127	Csc 332: Text Editor	Python	859	3	1	3
sublime-haskell-cabal	Twinside/sublime-haskell-cabal	4799941	Syntax for Haskell cabal (build system) for the "Sublime text" editor	null	92	3	2	3
gherkin-ide	pmazak/gherkin-ide	2386800	Lightweight HTML Text Editor with Auto-Completion for writing your Cucumber Gherkin Steps	Ruby	114	3	4	3
writeily	jpsullivan/writeily	20932218	Android markdown text editor app	C	2131	3	1	3
notepad	KaOSx/notepad	21616920	Very simple text-editor for use during kf5/plasma transition	C++	144	3	2	3
yate	dcestari/yate	3209171	Yet Another Text Editor	Python	172	3	0	3
werf	hadrianw/werf	38715220	Mouse driven text editor inspired by Acme (text editor from Plan 9).	C	120	3	0	3
UrWeb-Language-Definition	gwalborn/UrWeb-Language-Definition	29062491	UrWeb Package for Sublime Text Editor	null	212	3	0	3
Whizzywing	unverse/Whizzywing	2987199	Lightweight WYSIWYG rich text editor in javascript	JavaScript	278	3	0	3
HtmlArea	thetalecrafter/HtmlArea	2656059	Inkwall's simple but extensible rich-text editor	JavaScript	912	3	0	3
codeforces-plugin-sublime-text	cpragadeesh/codeforces-plugin-sublime-text	31782017	Codeforces build for Sublime Text Editor	Python	164	3	1	3
ui-texteditor	Vik2015/ui-texteditor	23493000	Basic text editor written using ui module.	Python	139	3	1	3
vim-getting-started	jaxbot/vim-getting-started	19312041	Getting Started Tutorial for the Vim Text Editor	CSS	188	3	0	3
peeredit	jorendorff/peeredit	43442097	A toy collaborative text editor to illustrate CRDTs.	JavaScript	83	3	0	3
JEditor	musaeed/JEditor	18334886	A lightweight text editor with many modern functions	Java	50666	3	2	3
e	mtve/e	21990013	minimalistic full screen text editor on ncurses	C	112	3	0	3
Thunderpad	alex-spataru/Thunderpad	15854225	A simple, powerful and cross-platform text editor	C++	24172	3	0	3
textserver	tarao/textserver	331502	Edit on Firefox using external text editors. 	JavaScript	148	3	0	3
quail-ckeditor	quailjs/quail-ckeditor	19985956	Accessibility feedbacl for the CKEditor text editor.	JavaScript	276	3	1	3
geocode	stingclaw/geocode	54385045	A simple open source text editor for OSX﻿	Objective-C	466	3	1	3
clangide	pippijn/clangide	4261573	Qt text editor with Clang parser integration.	C++	204	3	1	3
om-rte	nhusher/om-rte	19624927	A simple rich text editor in Om	Clojure	1552	3	1	3
restr	nitipit/restr	7573260	Restr - Restructured Text editor for Gnome	Python	1656	3	0	3
tinymce-tts	owntheweb/tinymce-tts	1352968	Text-to-speech Text Editor Plugin for TinyMCE	JavaScript	224	3	0	3
GEdit-HAML-Snippets	krzyczak/GEdit-HAML-Snippets	446105	HAML template snippets for GEdit text editor.	Shell	76	3	0	3
Brackets-Deep-Blue-Theme	Neats29/Brackets-Deep-Blue-Theme	38070864	A theme for the Adobe Brackets Text Editor	CSS	2022	3	1	3
Noteplaid	amccarthy1/Noteplaid	16581867	Plaid text editor. Perfect for hipsters	C#	1817	3	1	3
CS-51-Final-Project	yuechen/CS-51-Final-Project	14005266	Text editor with English language syntax highlighting	Java	60	3	1	3
led	cessen/led	28025559	A simple text editor written in Rust	Rust	408	3	1	3
tome-editor	NickStefan/tome-editor	52636190	Rich Text Editor entirely in javascript	JavaScript	56	3	0	3
LittleWriter	Giova84/LittleWriter	10845837	A rich text editor for Haiku	C++	471	3	1	3
syntaxdb-atom-plugin	Coteh/syntaxdb-atom-plugin	64262963	A SyntaxDB plugin for Atom text editor.	JavaScript	312	3	0	3
Tincta	CodingFriends/Tincta	67435368	The famous and much-loved text editor Tincta	Objective-C	6991	3	0	3
recorder.js	mrjoelkemp/recorder.js	15976492	Text recorder for textareas and text editors	JavaScript	3285	3	1	3
editor	bmcmahen/editor	16113199	structured text editor built w/ contenteditable	JavaScript	6896	3	0	3
NetPad	thiagoalz/NetPad	1463711	Simple collaborative text editor using OpenOrb.	Java	8722	3	1	3
Vico	bastibe/Vico	2040759	My site.nu for the text editor Vico	Nu	89	3	0	3
django-kindeditor	Rykka/django-kindeditor	9273967	Kindeditor widget as django rich text editor.	JavaScript	541	3	0	3
nTxt	lkjcalc/nTxt	25066987	Text editor for the Nspire calculator series	C	136	3	1	3
mint-ui	1inus/mint-ui	32720337	a suite of jquery web plugin.include imgcut,dialog,form validator,markdowneditor,rich text editor.	JavaScript	2036	3	2	3
ace_polymer.dart	danschultz/ace_polymer.dart	23783680	A Polymer.dart component for the Cloud9 Ace text editor	JavaScript	3920	3	0	3
stylekit	graphiclife/stylekit	8551024	Convenience macros for defining text-editor-like styles for Objective-C	Objective-C	140	3	0	3
ceditor-test	cheukyin699/ceditor-test	30005063	A simple terminal text editor implementation in C++ with ncurses	C++	148	3	2	3
browserpad	browserpad/browserpad	30202756	A server-less plain text editor in the browser.	HTML	59	3	0	3
text_tunnel	jackc/text_tunnel	5059752	Use your local text editor to edit files on remote servers.	Ruby	152	3	0	3
dropedit	zacclark/dropedit	1012493	Student project for a java-powered web-based Dropbox text editor.	Java	276	3	0	3
sublime-ariatemplates-snippets	ariatemplates/sublime-ariatemplates-snippets	9375783	A collection of useful Aria Templates snippets for Sublime Text editor.	null	112	3	0	3
bespin_area	jamesprior/bespin_area	523736	A Rails plugin to replace textareas with Bespin powered text editors	Ruby	592	3	0	3
gofill	crawshaw/gofill	17315733	gofill is an experimental hinting service for text editors	Go	204	3	0	3
Slickrock-FlashDevelop	NicoM1/Slickrock-FlashDevelop	23475447	A dark, clean, minimal theme for the FlashDevelop text-editor.	null	216	3	0	3
atom-typescript	seanhess/atom-typescript	19275691	Typescript Language Support for Atom Text Editor with IDE-like features. 	CoffeeScript	204	3	0	3
atom-objc-2-rubymotion	ahmetabdi/atom-objc-2-rubymotion	17373498	Objective-C to RubyMotion converter for atom the hackable text editor	CoffeeScript	244	3	1	3
AirC	MichaelParadis/AirC	53541950	The official text editor of the Aircraft Carrier Squad.	null	0	3	0	3
s3edit	ladekjaer/s3edit	15885795	Opens a file on Amazon S3 in default text editor.	JavaScript	7	3	1	3
Slickrock	NicoM1/Slickrock	22860640	A dark, clean, minimal theme for the Brackets text-editor.	CSS	124	3	0	3
fisked	fisk/fisked	41469918	The world's best text editor for the terminal.	Java	9642	3	1	3
kohana-lwrte	JDStraughan/kohana-lwrte	1319376	A simple wrapper for the Lightweight Rich Text Editor for jQuery	JavaScript	121	3	0	3
simple_rte	shaneriley/simple_rte	1522341	Simple RTE - a simple rich text editor jQuery plugin	JavaScript	152	3	0	3
Cylinder	Adam01/Cylinder	31028006	A web-browser based remote file access manager and text editor	Python	264	3	0	3
luced	osch/luced	286417	The Lucid Editor - a fast & lightweight text editor for X11.	C++	3823	3	1	3
richer	nickretallack/richer	40349006	A Collaborative Rich Text Editor that doesn't use contenteditable	CoffeeScript	164	3	0	3
multiedit	pandeiro/multiedit	3573167	A simple text editor for note-taking from the browser	Clojure	1184	3	0	3
void	PolyglotSymposium/void	28975242	A fearless modern text editor in the spirit of Vim	F#	925	3	0	3
editor	schell/editor	15775734	An experimental text editor using freetype2 and OpenGL. Written in Haskell.	Haskell	920	3	0	3
SVG.sugar	sdussaut/SVG.sugar	1424381	Sugar to add SVG support to Espresso text editor	null	164	3	0	3
SmartTE	smartboyathome/SmartTE	781256	SmartTE is Smartboy's text editor, with its main feature being BBCode support!	Python	184	3	0	3
kate_directory_project	cjbottaro/kate_directory_project	18044	Kate (KDE Advanced Text Editor) plugin that mimics TextMate's project functionality.	Python	81	3	1	3
Brackets-Pronama-Editor	tuyapin/Brackets-Pronama-Editor	27729204	Display "MASCOT CHARACTERS APPS CONTEST 2014"'s characters as the background of text editor.	JavaScript	732	3	0	3
Alfred-Plain-Text-Note	maguay/Alfred-Plain-Text-Note	9161935	Make a plain text note and open it in your default text editor with Alfred	null	120	3	0	3
Vegas	vegastexteditor/Vegas	1782024	A configurable, extensable, text editor with a focus on usability and progressive efficiency.	JavaScript	3884	3	0	3
atom-rename-tabs	jprichardson/atom-rename-tabs	39959333	Rename tabs titles with previous directory. Consistent with Sublime Text Editor behavior.	JavaScript	116	3	2	3
brackets-cursor	maupin/brackets-cursor	30199055	An extension to add cursor display options to Adobe's Brackets text editor.	JavaScript	29	3	1	3
artoo-editor	luizperes/artoo-editor	49124879	Artoo Editor is a text editor for terminals based on ncurses library	C	34	3	0	3
witchr	maciejjankowski/witchr	11471190	Reload browser from your text editor in the simplest, ugliest, socket.io based implementation ever	JavaScript	3200	3	0	3
language-newlisp	cormullion/language-newlisp	17510329	newLISP (not Lisp) syntax highlighting for atom.io, GitHub's new text editor 	CoffeeScript	296	3	0	3
react-typewrite	antoniocapelo/react-typewrite	48952013	ReactJS component that simulates the effect of typing on a text editor	JavaScript	351	3	0	3
tahrir	eslammostafa/tahrir	4019939	Tahrir is a neat text editor designed for linux, it is written in python/gtk.	Python	225	3	0	3
FrexxEd	vidarh/FrexxEd	730924	FrexxEd is a flexible Amiga text editor with scripting support, ARexx, multiple views, built in filesystem handler for open buffers and more	C	1428	3	0	3
