name	full_name	id	description	language	size	watchers	forks	stargazers_count
TextEditor	rchrd2/TextEditor	43270150	Simple Text Editor for Sandstorm built with MeteorJS	HTML	194	9	2	9
angular-inline-text-editor	Blitzen/angular-inline-text-editor	32337711	A very basic WYSIWYG inline editor for AngularJS	JavaScript	1095	9	4	9
Draft	coppolaemilio/Draft	8932981	Rich text editor for elementaryOS	Python	109	9	4	9
TextFlow	textflow/TextFlow	417237	Clean and customizable text editor	Python	643	9	4	9
Conky-GUI	givanse/Conky-GUI	4344087	Text editor for Conky configuration files.	Scala	1288	9	4	9
cozy-editor	cozy/cozy-editor	6869266	A cozy text editor	JavaScript	3021	9	2	9
editor	mazarf/editor	24660004	Text editor using ncurses library	C	146	9	2	9
PagesTextEdit	dimkanovikov/PagesTextEdit	19339151	Qt page based text editor (like OO Writer, MS Word, etc.)	C++	270	9	4	9
ged	8l/ged	25416271	simple gtk text editor written in c	C	140	9	4	9
MODX-Placeholders	mkay/MODX-Placeholders	24456443	MODX Placeholders Snippets for the Sublime Text Editor 	Shell	130	9	3	9
retext	fzumstein/retext	8039162	Forked from sourceforge. ReText is a simple but powerful text editor for Markdown and reStructuredText. 	Python	753	9	3	9
vibenotes	rejectedsoftware/vibenotes	4084453	A fast and slim real-time collaborative text editor 	JavaScript	297	9	3	9
speech-tagger	cosmicexplorer/speech-tagger	40948283	tag parts of speech with nlp libraries for use in text editors	Emacs Lisp	31818	9	3	9
atom-ruby-debugger	johanlunds/atom-ruby-debugger	30575411	Simple Ruby-debugger for Github's text editor Atom	CoffeeScript	2576	9	2	9
ih.textile_editor.ee_addon	imagehat/ih.textile_editor.ee_addon	162021	Textile Editor Helper (TEH) toolbar for EE 1.6.x	JavaScript	123	9	1	9
despin	past/despin	322623	A text editor for Firefox	JavaScript	2212	9	1	9
spotify-remote	theHazzard/spotify-remote	45590915	Remote control for spotify without leaving your favorite text editor!	CoffeeScript	15	9	2	9
Sublime-W3CValidators	dubharmonic/Sublime-W3CValidators	14720572	W3C markup validator package for the Sublime Text 2 text editor.	JavaScript	153	9	2	9
MightEMacs	italia389/MightEMacs	43406025	Fast and full-featured Emacs text editor	C	2433	9	0	9
chef-dev-workstation	scarolan/chef-dev-workstation	16954940	Chef cookbook for setting up a test-driven cookbook development environment.  Includes vim, nano and emacs text editors, and a suite of tools and plugins to help you test as you develop	Ruby	594	9	5	9
wysiwyg-cake	froala/wysiwyg-cake	16730957	CakePHP Plugin for Froala Javascript WYSIWYG Text Editor. The editor is free only for non-commercial projects. For commercial applications you have to purchase a license from	JavaScript	1214	9	4	9
atom-sftp	jules-r/atom-sftp	17783696	SFTP/FTP client for Atom text editor	CoffeeScript	177	9	0	9
virn	jkramer/virn	191422	Rename lots of files using your favorite text editor.	Shell	116	9	1	9
react-editor-component	NextThought/react-editor-component	28921252	Rich text editor content editable react component	JavaScript	126	9	0	9
swizzle	chrissimpkins/swizzle	12716054	A dark Markdown theme for the Mou and Lightpaper Markdown text editors	Shell	220	9	0	9
nbespin	bengl/nbespin	545849	A text editor with Bespin Embedded as a frontend and Node.js as a backend.	CoffeeScript	100	9	0	9
RichTextComposer	shirejiang/RichTextComposer	21204460	A simple demo which use webView as rich text editor.	Objective-C	868	9	0	9
angularTextEditor	vitconte/angularTextEditor	16643800	Text Editor with AngularJS	null	176	8	2	8
TextPad	maxistar/TextPad	2543820	Simple Text Editor for Android	Java	770	8	5	8
E-Max	glyph/E-Max	5149152	Emacs keybindings for the Sublime Text editor.	Python	32	8	10	8
Java-Notepad	six519/Java-Notepad	1277707	A basic text editor created in Java	Java	3	8	11	8
default-text-editor	eclipselabs/default-text-editor	34222491	Makes the internal text editor of Eclipse to be the default editor for unknown files.	Java	213	8	1	8
rich-text-fragment	rupertbates/rich-text-fragment	8180938	A rich text editor for Android	Java	523	8	5	8
SuperbEdit	SuperbEdit/SuperbEdit	24451142	Superbe Text Editor	C#	1375	8	2	8
writeily	jffrymrtn/writeily	19151064	Android markdown text editor app	C	2918	8	3	8
tea-qt	psemiletov/tea-qt	51516922	TEA text editor	C++	790	8	2	8
android-rich-text-editor	adelnizamutdinov/android-rich-text-editor	18573117	playground	Java	1452	8	2	8
ih.textile_editor.ee2_addon	imagehat/ih.textile_editor.ee2_addon	678059	Textile Editor Helper (TEH) toolbar for EE	JavaScript	160	8	3	8
sublime-task-timer	jcowgar/sublime-task-timer	8895182	A simple task timer for Sublime Text Editor	Python	103	8	4	8
sublime-netlinx	amclain/sublime-netlinx	19333842	Develop AMX NetLinx projects in the Sublime Text editor.	NetLinx	509	8	3	8
ember-froala-editor	froala/ember-froala-editor	53005035	Ember component for Froala WYSIWYG HTML Rich Text Editor.	JavaScript	1573	8	6	8
latex.sugar	pkalkul/latex.sugar	251420	Latex syntax sugar for the Espresso text editor	null	75	8	5	8
efte	lanurmi/efte	42006666	eFTE is a fork of FTE -- Folding Text Editor	C++	2645	8	4	8
Enyo-Calliope	rafabernad/Enyo-Calliope	4088492	An Enyo based graphical text editor	JavaScript	149	8	3	8
file_browser	eric1234/file_browser	830996	Web-based File Manager with Rich Text editor integration	Ruby	352	8	4	8
symbols-list	7ute/symbols-list	57117257	An alternate symbol list sidebar for Atom.io text editor	CoffeeScript	274	8	7	8
tor	kybin/tor	14360795	terminal text editor	Go	1293	8	0	8
InputfieldAceEditor	adamkiss/InputfieldAceEditor	6945362	[DISCONTINUED] Better ProcessWire text editor for developers and at least 'a little' tech savvy clients.	CSS	1292	8	5	8
Code-Font	TyGoss/Code-Font	14745844	Code-Font is an extension for the text editor Brackets that allows you to change the font of the coding window to one of ten popular Google Fonts.	null	128	8	13	8
JavaIME	tushortz/JavaIME	40699139	Turn your Sublime text into a java completion text editor.	JavaScript	3243	8	2	8
syntaxic	msipos/syntaxic	31066260	Open source text editor: Syntaxic	C++	3802	8	1	8
yui-rte-tables	bgkittrell/yui-rte-tables	902176	Table Editor for Yui's Rich Text Editor	JavaScript	100	8	0	8
mt-plugin-table-feature-for-tinymce	movabletype/mt-plugin-table-feature-for-tinymce	4896566	Add table feature to TinyMCE, that is default rich text editor of Movable Type 5.2 or later.	CSS	134	8	3	8
EditPlus	vim-scripts/EditPlus	4462877	A color scheme that mimics the standard scheme found in the EditPlus text editor	VimL	100	8	3	8
gedit-plugin-indent-converter	disfated/gedit-plugin-indent-converter	1810621	Plugin for Gedit text editor that adds feature to converts tabs to spaces and spaces to tabs	Python	104	8	3	8
Getan	bgarber/Getan	30836357	Getan - a modern text editor for old school programmers	C	110	8	0	8
tedit	lewish/tedit	7765048	Porting gedit to the terminal, a branch from Sanos simple text editor.	C	170	8	0	8
language-archlinux	fusion809/language-archlinux	60397772	Arch Linux development package for the Atom text editor (https://atom.io). 	CoffeeScript	91	8	1	8
gh2caret	thomaswilburn/gh2caret	14965006	To Caret, From Github: a demo plugin that sends source code from GitHub to Chrome OS's best text editor	JavaScript	140	8	2	8
Smarty-syntax-coloration-for-GEdit	dandelionmood/Smarty-syntax-coloration-for-GEdit	1688196	Provides a Smarty syntax coloration file for GEdit (or any GTKSourceView related text editor)	Shell	97	8	0	8
snowball	chrissimpkins/snowball	12854348	A light, clean Markdown text editor theme for the Mou and Lightpaper Markdown editors	Shell	2042	8	1	8
Akelpad-syntax-highlighting	Lenchik/Akelpad-syntax-highlighting	8361647	Syntax themes for AkelPad text editor with Coder plugin (AutoHotkey, AviSynth, BibTeX, Grub4Dos, KiXtart, LaTeX, nnCron, Smarty, plain text and many more other syntax highlighting)	null	1427	8	0	8
IT-Edit	mrcyberfighter/IT-Edit	53237642	It-Edit: an integrated terminal programming text-editor with many functionalities like a manpage reader, a documentation registering with direct accessing mechanism and many others settings and features.	C	24659	8	1	8
RTEditor	Tulakshana/RTEditor	4660767	RTEditor is a rich text editor which you can include in any iOS app. It is built using both HTML5 and Objective C. You can easily include RTEditor to any app written in Objective C. It supports bold, italic, underline, un-ordered lists, ordered lists, undo and redo. It also allow users to use markdown. This can be deployed in iOS5 or greater versions.	C	160	8	1	8
TextEditor	Mads-Clausen/TextEditor	9130983	A text editor written in C++.	C++	1078	7	4	7
XwtPlus.TextEditor	luiscubal/XwtPlus.TextEditor	18780575	A port of Mono.TextEditor to Xwt.	C#	1018	7	1	7
Wodo.TextEditor_release	kogmbh/Wodo.TextEditor_release	26686115	Wodo.TextEditor: OpenDocument Text Documents Editor (release repo, for package/dependency managers)	JavaScript	1262	7	4	7
html-text-editor	tovic/html-text-editor	23667845	This is the HTML version of the previous plugin called MTE → https://github.com/tovic/markdown-text-editor	JavaScript	178	7	0	7
parchment	gpbmike/parchment	3437217	A rich text editor	JavaScript	887	7	2	7
RTE-Kit	thisismedium/RTE-Kit	235636	Build your own Rich Text Editor	JavaScript	375	7	3	7
qpad	HouQiming/qpad	55034354	QPad Text Editor	C++	12951	7	1	7
cfwheels-rte-plugin	russjohnson/cfwheels-rte-plugin	527127	Rich Text Editor form helper plugin for CFWheels.	JavaScript	1556	7	3	7
sakura	mocaskr/sakura	20338831	Text editor "sakura"	C++	11082	7	0	7
brackets-twig-syntax-highlighter	adperezmorales/brackets-twig-syntax-highlighter	28782073	Twig syntax highlighter for Brackets text editor	JavaScript	136	7	1	7
groupeditor	kwhinnery/groupeditor	10249597	A group text editor using socket.io and Twilio	JavaScript	4654	7	3	7
language-jsonnet	google/language-jsonnet	43018615	Jsonnet language support for the Atom text editor	CoffeeScript	90	7	2	7
Vim-for-Rails-Developers	alanpeabody/Vim-for-Rails-Developers	940241	Introduction to using Vim as a Ruby On Rails text editor.	null	87	7	3	7
Sublime-Plugins	fxdgear/Sublime-Plugins	1368120	Plugins for Sublime Text editor	Python	121	7	0	7
escape-utils	BrightIT/escape-utils	21325651	An Atom text editor plugin to URL encode/decode text	CoffeeScript	734	7	2	7
texteditor	akshayysharma/texteditor	51849703	Text Editor Application for Windows 7 and above.	C#	614	7	1	7
snake	maxwells/snake	17781955	Snake game for Github's Atom text editor	CoffeeScript	180	7	0	7
LazyTextEdit	Andersbakken/LazyTextEdit	303629	A Qt based text editor that lazily loads data from disk when necessary.	C++	572	7	2	7
coffee-house	atg/coffee-house	101267	A website to manage sugars and themes for the Espresso text editor.	PHP	1484	7	0	7
ofxEditor	darrenmothersele/ofxEditor	14553732	A simple text editor for openFrameworks for live coding. Features multiple text buffers and the ability to define custom commands.	C++	327	7	3	7
wysiwyg-editor-v1	froala/wysiwyg-editor-v1	41638174	A flat designed jQuery WYSIWYG Rich Text Editor based on HTML5.	JavaScript	3264	7	0	7
sublime-text-sidebar-icons	mrliptontea/sublime-text-sidebar-icons	37773063	The collection of file type icons for Sublime Text editor	JavaScript	1701	7	1	7
DeftDraft	zencephalon/DeftDraft	5209317	A text editor that puts revision at your fingertips.	JavaScript	210	7	1	7
ShinyDroplets	shinyfrog/ShinyDroplets	486247	Shiny Droplets are small AppleScript-based applications that integrate with the Finder toolbar to provide fast shortcuts to text editors.	Objective-C	185	7	2	7
pathfinder_open_in_sublime	ramkola/pathfinder_open_in_sublime	7222851	Plugin for Path Finder Mac App - Opens chosen file or folder in Sublime Text Editor (Based on Open in Textmate Plugin)	Objective-C	200	7	2	7
react-editor	fritx/react-editor	48916371	(WIP) Rich-Text Editor that behaves like Tencent QQ's.	JavaScript	44	7	1	7
yocto	akrennmair/yocto	142166	yocto is a minimalistic ncurses-based text editor. It is smaller than pico and nano.	C	152	7	0	7
MomentsApp	aljc/MomentsApp	32881091	Gratitude journal-style iOS app that allows users to create moments using native image and text editors. iPhone and iPad compatible. Find Moments on the App Store today. See: https://github.com/aljc/MomentsApp/blob/master/MarketingMaterials/github-aljc_marketing.pdf	Objective-C	3498	7	2	7
fmpvc	MartinBoswell/fmpvc	37432208	Process FileMaker Pro Advanced's Database Design Report (DDR) to produce textual representations of the design objects for use with version control systems, text editors, etc.	Ruby	472	7	1	7
codelines	returningsam/codelines	56442483	Javascript that generates random lines on an html page that looks like code. Modeled after the the mini-map extension for the Atom text editor	JavaScript	14	7	0	7
rich-text-editor	sproutcore/rich-text-editor	20417179	A rich text editor for SproutCore.	JavaScript	835	6	8	6
texteditor	antonte/texteditor	16419605	text editor	C++	479	6	4	6
DropNotes	MatheusBrum/DropNotes	1998644	A DropBox based text editor	Objective-C	385	6	3	6
linuxgems	kevinthew/linuxgems	8637264	A succinct cheat sheet for newbie linux coders and system administrators, documenting some of the more obscure and useful gems of linux lore. Intended to be viewed in emacs org-mode, or VimOrganizer, though any text editor will suffice.	Shell	60	6	416	6
atom-zenburn	colindean/atom-zenburn	17927572	Zenburn color scheme for Atom text editor	CSS	203	6	6	6
FATE-Another-Text-Editor	Z-Shang/FATE-Another-Text-Editor	48301904	A Text Editor Specialized for Small Touch Screen Devices	JavaScript	2895	6	1	6
SmoothScroll	ricksladkey/SmoothScroll	16423405	Smooth Scrolling for the Visual Studio Text Editor	C#	221	6	3	6
editor	tdryer/editor	17647273	Simple curses-based text editor	Python	128	6	3	6
simple-text	eterevsky/simple-text	16694316	A sample Chrome app: very simple text editor	JavaScript	473	6	5	6
language-graphql	rmosolgo/language-graphql	40733573	GraphQL support for Atom text editor	CoffeeScript	14	6	2	6
d-quill	derbyjs/d-quill	19588861	Derby rich text editor component based on Quill	JavaScript	32	6	4	6
WysiwygImageUpload	gdbhosale/WysiwygImageUpload	14774660	Text Editor with Ajax Image Uploader using Bootstrap & Tiny Wysiwyg	CSS	617	6	4	6
DelphiStyleBookmarks	artkorsun/DelphiStyleBookmarks	6887550	Delphi style bookmarks for Sublime Text Editor	Python	110	6	4	6
quiedit	smathot/quiedit	2037698	Distraction-free, fullscreen text editor	Python	274	6	2	6
custom-editfield	tempelmann/custom-editfield	32188407	Powerful text editor class made in Xojo.	REALbasic	1998	6	3	6
tsunami	AndyMoreland/tsunami	48966341	Typescript IDE for text editors (emacs, vscode)	TypeScript	124	6	2	6
EditorEngine	continuoustests/EditorEngine	2120068	A background engine for integrating with various text editors	C#	2211	6	3	6
atom-simple-align	stevenhauser/atom-simple-align	40447923	Simple multiple cursor alignment for Atom text editor	JavaScript	6	6	2	6
pike-for-sublime	poppa/pike-for-sublime	6719468	Pike syntax definition for the Sublime text editor	Pike	1126	6	2	6
repl-edit	samsonjs/repl-edit	935496	edit Node repl commands with your text editor	JavaScript	121	6	2	6
StudioSync	EgoMoose/StudioSync	52703838	Allows for usage of outside text editors in Roblox studio	Lua	3	6	1	6
InkBar	KeiferMiller/InkBar	2067921	A text editor for android	Java	6872	6	0	6
sublimeText3-Userfiles	aziz/sublimeText3-Userfiles	15499902	My text-editor config files	JavaScript	998	6	0	6
SubLAME	ibito/SubLAME	18981985	A webkit-based text editor using CodeMirror that is not splendid or sublime	JavaScript	3196	6	2	6
vigorsh	kana/vigorsh	52501	vi-like text editor based on Gauche	null	96	6	1	6
Lethe	esbeto/Lethe	3593589	A dark theme for gedit (text-editor)	null	430	6	0	6
mdRichEditor	michaelpwilson/mdRichEditor	46241797	A lightweight rich text editor for Angular Material	JavaScript	1237	6	1	6
nano-win	lhmouse/nano-win	21653131	GNU nano text editor for Windows	C	30088	6	0	6
Quigley	t3rse/Quigley	4983909	Quigley is a HTML5 / Javascript Text Editor	JavaScript	2140	6	1	6
pye	ajbonkoski/pye	10546574	PyE is a modern terminal-based text-editor	C	584	6	1	6
eli	zachwhaley/eli	47435078	A simply made text editor written in C	C	41	6	0	6
textmash	naleksander/textmash	1339797	general purpose text editor with Clojure support	Clojure	1097	6	0	6
MavensMate-Brackets	joeferraro/MavensMate-Brackets	17099117	MavensMate plugin for the Brackets text editor	JavaScript	168	6	1	6
wreditor	WrtApp/wreditor	9182641	Standalone version of the Write.app text editor	JavaScript	2418	6	0	6
atom-dlang	ColdenCullen/atom-dlang	18340791	A d language binding for the Atom text editor.	CoffeeScript	240	6	2	6
angular2-froala-wysiwyg	froala/angular2-froala-wysiwyg	63350161	AngularJS2 bindings for Froala WYSIWYG HTML Rich Text Editor.	TypeScript	780	6	2	6
sublime-text-dev	KaOS-Community-Packages/sublime-text-dev	19010270	Sublime Text is a sophisticated text editor for code, markup and prose.	Shell	5	6	1	6
ace-minimap	rocketinventor/ace-minimap	41615913	A plugin to add a minimap to ace text editor	JavaScript	220	6	1	6
GDScript-Geany	haimat/GDScript-Geany	17349298	GDScript (Godot Engine) filetype spec for the Geany text editor	null	164	6	0	6
iphone-scaffold	mml/iphone-scaffold	192447	minimal Makefile and directory structure to make an iPhone application, fully penetrable with a text editor	Objective-C	77	6	2	6
atom-language-api-blueprint	danielgtaylor/atom-language-api-blueprint	34705237	API Blueprint and MSON grammars for the Atom.io text editor.	CoffeeScript	140	6	0	6
tyreese	lf94/tyreese	26377503	tyreese is a text editor that focuses on simplicity, both in code and execution.	C	128	6	1	6
dfte	d1f/dfte	911586	dFTE is fork of eFTE which is fork of FTE - folding text editor	C++	108	6	0	6
pyedit	pfalcon/pyedit	33772774	Simple text editor widget for Python and MicroPython. Further developed in https://github.com/pfalcon/picotui	Python	208	6	1	6
IC_Edit	cuplv/IC_Edit	44281764	Feature-rich text editor written simply, running efficiently with incremental computation by Adapton	Rust	471	6	0	6
neovim-konsole	harish2704/neovim-konsole	48882194	Wrapper script and config files to use neovim+konsole as a normal gui text editor	Shell	61	6	1	6
AcidCupcakeColourScheme	jsantell/AcidCupcakeColourScheme	1776613	A vibrant, dark and obnoxiously awesome colour scheme for text editors and terminals.	VimL	101	6	1	6
Kaleidoscope.sugar	onecrayon/Kaleidoscope.sugar	9107370	Quickly diff files in Kaleidoscope from the Espresso text editor for Mac OS X	Python	204	6	1	6
Jigger-sugar	onecrayon/Jigger-sugar	6033629	Provides quick color, number, and file URL adjustments for the Espresso text editor on Mac OS X	Objective-C	214	6	0	6
imitation	code-tree/imitation	31596264	Imitation is a plugin for the gedit text editor, that allows the user to edit a document in multiple places simultaneously, to aid repetitive programming tasks.	Python	3517	6	0	6
vala-apps	simargl/vala-apps	35345219	Agatha: PDF Viewer in GTK3 and Poppler,   Dlauncher: Desktop file launcher,   Emendo: Text editor with syntax highlighting,  Taeni: Multi-tabbed terminal emulator based on VTE,  Voyager: Fast and elegant image browser,  WPSet: A simple tool for changing your desktop wallpaper	CMake	1693	6	1	6
code-editor-theme	watsnow/code-editor-theme	2760947	IDE and text editor themes	null	203	5	6	5
SimpleTextEditor	batizhao/SimpleTextEditor	3521486	My Third iOS App.	Objective-C	96	5	1	5
Mono.TextEditor.XWT	aBothe/Mono.TextEditor.XWT	11177036	The MonoDevelop text editor component ported to XWT	C#	692	5	1	5
linden-scripting-language	buildersbrewery/linden-scripting-language	38029987	Linden Scripting Language (LSL) support for your text editor.	CoffeeScript	4804	5	6	5
dotvim	roryokane/dotvim	2162841	My .vim directory; configuration for the Vim text editor.	VimL	583	5	4	5
puppet-atom	tarebyte/puppet-atom	19835161	Boxen module to install Atom, GitHub's text editor	Puppet	164	5	5	5
django-wymeditor	gabrielhurley/django-wymeditor	1621672	A simple Django app that allows you to easily use WYMEditor as your rich text editor for form fields.	JavaScript	241	5	9	5
Legal-Snippets-Sublime	compleatang/Legal-Snippets-Sublime	8334403	Snippets for Creating Legal Documents within Sublime Text Editor.	Python	130	5	3	5
atom-laravel-snippets	nmfzone/atom-laravel-snippets	45286389	Laravel Snippets for Atom Text Editor	CoffeeScript	140	5	1	5
zoinks	mikevoydanoff/zoinks	76964	zoinks text editor	C++	503	5	0	5
jkl	dcbishop/jkl	24525703	Jkl text editor.	Go	400	5	0	5
one	halcat0x15a/one	3956062	online text editor	Clojure	3597	5	0	5
Scribber	senft/Scribber	1823007	A minimalistic text editor.	Python	1011	5	0	5
te	khamidou/te	162925	A minimalistic text editor	C	136	5	0	5
Cluffer	robert-strandh/Cluffer	46842881	General-purpose text-editor buffer.	TeX	506	5	1	5
kent	CodePicnic/kent	60868522	Simple rich text editor	JavaScript	504	5	0	5
bootstrap-lwrte	synyx/bootstrap-lwrte	6279613	Lightweight Rich Text Editor (RTE / WYSIWYG) plugin for jQuery with Bootstrap Look and Feel	JavaScript	220	5	5	5
Markdown	idno/Markdown	31136943	Replaces Known's rich text editor with a markdown editor.	PHP	183	5	2	5
VIM_Themes	VitaminFarmer/VIM_Themes	60120182	Color schemes for the beloved text editor, VIM.	VimL	89	5	2	5
redcar-sparkup	pockata/redcar-sparkup	1691072	Adds Sparkup capabilities to the Redcar text editor	Ruby	18624	5	2	5
AlphaPy	tusharmakkar08/AlphaPy	12298359	Text Editor Made in Python 	Python	396	5	1	5
femto	lambdalisue/femto	8101670	A simple JavaScript Text Editor	CoffeeScript	2806	5	0	5
phoneme-client	dzucconi/phoneme-client	8973979	Simple text editor that calls to the Corrasable API to convert text into it's Arpabet representation	JavaScript	149	5	3	5
Wind-Wheel-Theme-for-Espresso	minimalweb/Wind-Wheel-Theme-for-Espresso	1294592	Syntax Highlighting for Espresso Text Editor	null	220	5	0	5
gmate-editor	lexrupy/gmate-editor	177728	A Plugin based text editor for programmers	null	128	5	0	5
Minerva	admiral0/Minerva	630096	Minerva is a programmer's text editor	C++	2280	5	0	5
textadept_pkg	bingalls/textadept_pkg	1720066	Lite text editor, packaged for various OSes	Shell	84615	5	0	5
kashiki	mitoma/kashiki	18489314	Kashiki is OpenGL base text editor.	Java	9851	5	1	5
scribes	mystilleef/scribes	8989394	simple and slick text editor for GNOME	null	112	5	0	5
sith	wx13/sith	43074400	Console text editor written in go	Go	186	5	1	5
sublime-dev-packages	eduardolundgren/sublime-dev-packages	2125324	Sublime Text Editor 2 developer utils	Python	115	5	1	5
space-block-jumper	aronj/space-block-jumper	17840146	Navigational package for the atom text editor	CoffeeScript	240	5	0	5
pim	chiiph/pim	680885	A python vim/emacs like text editor	Python	160	5	0	5
jQuery.spHtmlEditor	MakingThingsWorkToronto/jQuery.spHtmlEditor	39101777	SharePoint Rich Text Editor jQuery Plugin	JavaScript	7	5	1	5
edbee-lib	edbee/edbee-lib	16339786	QWidget based Text Editor Component for Qt. Multi-caret, Textmate grammar and highlighting support. 	C++	1316	5	3	5
Panopto-Button-for-Atto	Panopto/Panopto-Button-for-Atto	24425688	Panopto Button plugin for Atto rich text editor in moodle, enabling the posting of embedded Panopto video	PHP	37	5	3	5
jedi	wx13/jedi	2614231	A text editor for the unix console	Ruby	978	5	1	5
sqbrowser	cbess/sqbrowser	2362479	SQLite Query Browser for any text editor. Uses wxPython 2.8+	Python	163	5	1	5
SublimePerforce	seanhoughton/SublimePerforce	2593190	A perforce plugin for the Sublime Text editor	Python	96	5	0	5
Smultron	flomac/Smultron	560541	A now unsupported Open Source Text Editor for MAC OS X developed originally by Peter Borg	Objective-C	3440	5	2	5
sublime-online-searcher	rajeshvaya/sublime-online-searcher	20861299	This plugin enables the user to search online right from the sublime text editor. User can search through input, right-clicking the selected text and through general key-bindings.	Python	245	5	3	5
wysihatter	wiseleyb/wysihatter	554831	A plugin for 37signals WysiHat rich text editor	Ruby	132	5	0	5
hodorjs	oltodo/hodorjs	29241958	[WIP] A Javascript Block-Style & Ultra-Structured Text editor	JavaScript	3528	5	0	5
famousst	sun2rise/famousst	23980918	A Famo.us package for Sublime Text editor	JavaScript	204	5	0	5
PerspexEdit	danwalmsley/PerspexEdit	34141537	A text editor for Perspex based off AvalonEdit.	C#	848	5	1	5
BBEdit-Language-Modules	grantneufeld/BBEdit-Language-Modules	810257	Language Modules for the BBEdit text editor on Mac OS X	null	181	5	2	5
Debulhator	antonioforte/Debulhator	2256440	A text editor built with PyQt and Scintilla.	Python	1352	5	1	5
mle	adsr/mle	28325201	a small but powerful console text editor (C)	C	438	5	1	5
blackboard-contrast	miekd/blackboard-contrast	2222278	A more contrasty version of a text-editor theme derived from Blackboard for TextMate.	null	96	5	0	5
power-gedit	shiloa/power-gedit	184301	collection of themes, plugins, snippets and language files to supercharge gedit text editor for gnome	Python	404	5	1	5
red	XMPPwocky/red	20067902	Text editor in Rust. Heavy vim influences, designed with the MVC pattern for flexibility.	Rust	248	5	0	5
newlisp-sublime-text-2-package	cormullion/newlisp-sublime-text-2-package	2505644	first attempt at a newLISP package for the Sublime Text 2 text editor	null	117	5	0	5
terminal-editor-helpers	benspaulding/terminal-editor-helpers	3476087	A collection of helper scripts for using popular Mac text editors as your terminal EDITOR.	Shell	91	5	0	5
scroll-searcher	Aakash1312/scroll-searcher	48749102	A package for Atom text editor to display find-and-replace markers on scrollbar 	CoffeeScript	658	5	1	5
ICSharpCode.TextEditorEx	StefH/ICSharpCode.TextEditorEx	22696856	Extended version based on ICSharpCode.TextEditor which support Search/Replace and Goto	C#	1306	4	7	4
text-editor	tovic/text-editor	16975240	A text selection range API written in pure JavaScript, for modern browsers.	HTML	125	4	2	4
AndroidTextEditor	nallagsoc/AndroidTextEditor	24841219	Android Text Editor	Java	250	4	4	4
cloud-text-editor	vinodc/cloud-text-editor	18422410	A simple example app using the Kloudless SDK to store files to cloud storage.	Python	244	4	2	4
