,name,full_name,id,description,language,size,watchers,forks,stargazers_count,group
5836,tmdbsimple,celiao/tmdbsimple,14947242.0,A wrapper for The Movie Database API v3.,Python,102.0,76.0,27.0,76.0,database
5838,postgresql-portable,garethflowers/postgresql-portable,33385881.0,"Portable version of the PostgreSQL Database Server, for Windows",Perl,185965.0,76.0,12.0,76.0,database
5839,query_diet,makandra/query_diet,735739.0,A Rails database query counter that stays out of your way,Ruby,104.0,76.0,6.0,76.0,database
5840,sqlhooks,gchaincl/sqlhooks,56711473.0,Attach hooks to any database/sql driver,Go,51.0,76.0,2.0,76.0,database
5843,stockdb,maxlapshin/stockdb,5372053.0,Database for storing Stock Exchange quotes in erlang,Erlang,525.0,75.0,32.0,75.0,database
5844,42-django-couchdb,42/42-django-couchdb,234381.0,django couchdb database adapter,Python,108.0,75.0,3.0,75.0,database
5847,pldb,threatgrid/pldb,7529288.0,(DEPRECATED) persistent logic database for clojure core.logic,Clojure,165.0,75.0,6.0,75.0,database
5854,fossology,fossology/fossology,15866170.0,"FOSSology is an open source license compliance software system and toolkit.  As a toolkit you can run license, copyright and export control scans from the command line.  As a system, a database and web ui are provided to give you a compliance workflow. License, copyright and export scanners are tools used in the workflow.",C,279479.0,74.0,36.0,74.0,database
5859,grails-database-migration,grails-plugins/grails-database-migration,1079266.0,Grails Database Migration Plugin,Groovy,3097.0,72.0,92.0,72.0,database
5860,YapDatabaseExtensions,danthorpe/YapDatabaseExtensions,33999429.0,YapDatabase extensions for use with Swift,Swift,3413.0,72.0,12.0,72.0,database
5861,db2fog,yob/db2fog,2084088.0,store your rails database backups in the cloud,Ruby,79.0,72.0,34.0,72.0,database
5863,django_cassandra_backend,vaterlaus/django_cassandra_backend,908955.0,A Django database backend for Cassandra,Python,212.0,72.0,15.0,72.0,database
5864,php-rest-sql,peej/php-rest-sql,5265301.0,Play with our RESTful database interface with our interactive REST tutorial,PHP,158.0,72.0,29.0,72.0,database
5867,lmdbxx,bendiken/lmdbxx,33577674.0,C++11 wrapper for the LMDB embedded B+ tree database library.,C++,206.0,72.0,20.0,72.0,database
5871,database,classicdb/database,9145124.0,"Classic DB is a content database for CMaNGOS Classic: world, NPCs, objects, quests and so on.",Shell,229810.0,71.0,70.0,71.0,database
5874,db_connection,elixir-ecto/db_connection,46829184.0,Database connection behaviour,Elixir,356.0,71.0,20.0,71.0,database
5875,django-safedelete,makinacorpus/django-safedelete,10792977.0,Mask your objects instead of deleting them from your database.,Python,118.0,71.0,22.0,71.0,database
5876,s3-shell-backups,lumerit/s3-shell-backups,3410368.0,Shell scripts to backup files and databases to Amazon S3,Shell,137.0,71.0,26.0,71.0,database
5878,node-migrate,rsandor/node-migrate,643179.0,A database agnostic migration system for Node.js.,JavaScript,237.0,71.0,5.0,71.0,database
5879,nmig,AnatolyUss/nmig,47531532.0,"NMIG is a database migration tool, written in Node.js and highly inspired by FromMySqlToPostgreSql.  ",JavaScript,236.0,71.0,16.0,71.0,database
5882,Stouts.backup,Stouts/Stouts.backup,20230316.0,"Ansible role to backup files, databases",Shell,128.0,70.0,20.0,70.0,database
5884,cl-dbi,fukamachi/cl-dbi,2635521.0,Database independent interface for Common Lisp,Common Lisp,121.0,70.0,14.0,70.0,database
5885,redis-dump-load,p/redis-dump-load,2239736.0,"Dump redis databases, load data into redis - in Python",Python,121.0,70.0,24.0,70.0,database
5886,cascading-dbmigrate,Cascading/cascading-dbmigrate,576623.0,Tool to help users migrate large relational databases into Hadoop clusters.,Java,183.0,70.0,16.0,70.0,database
5887,pyley,ziyasal/pyley,21630462.0,Python client for an open-source graph database Cayley,Python,71.0,70.0,10.0,70.0,database
5889,node-pg-copy-streams,brianc/node-pg-copy-streams,13964315.0,"COPY FROM / COPY TO for node-postgres.  Stream from one database to another, and stuff.",JavaScript,80.0,70.0,20.0,70.0,database
5893,mbzdb,elliotchance/mbzdb,721618.0,Port of the MusicBrainz database to run on other RDBMSs with replication (previously named MB_MySQL.),Perl,316.0,69.0,29.0,69.0,database
5894,CraueConfigBundle,craue/CraueConfigBundle,2011216.0,Database-stored settings made available via a service for your Symfony project.,PHP,178.0,69.0,18.0,69.0,database
5897,ModelGenerator,laracademy/ModelGenerator,58608102.0,modelgen is a command that will quickly generate a model for you based on your current table scheme found in your database.,PHP,11.0,69.0,1.0,69.0,database
5901,lmdb,clibs/lmdb,23483866.0,Symas Lightning Memory-Mapped Database (LMDB),null,296.0,68.0,1.0,68.0,database
5904,dart_postgresql,xxgreg/dart_postgresql,8498401.0,Dart Postgresql database library.,Dart,546.0,67.0,28.0,67.0,database
5905,nkbase,NetComposer/nkbase,31018503.0,NkBASE distributed database,Erlang,506.0,67.0,8.0,67.0,database
5908,UK-Postcodes,Gibbs/UK-Postcodes,5361406.0,"A CSV database of UK postal out codes relating them to general co-ordinates, towns, counties and countries.",null,261.0,67.0,50.0,67.0,database
5909,transaction_retry,qertoip/transaction_retry,3376028.0,"Retries database transaction on deadlock and transaction serialization errors. Supports MySQL, PostgreSQL and SQLite.",Ruby,155.0,67.0,15.0,67.0,database
5911,testfixtures,go-testfixtures/testfixtures,55502590.0,:package: Rails-like test fixtures for Go. Write tests against a real database.,Go,47.0,67.0,1.0,67.0,database
5912,pgdbf,kstrauser/pgdbf,1316416.0,Convert XBase / FoxPro databases to PostgreSQL,C,397.0,66.0,22.0,66.0,database
5913,keymaker,therubymug/keymaker,4078494.0,A multi-layer REST API Ruby wrapper for the neo4j graph database.,Ruby,159.0,66.0,14.0,66.0,database
5917,simple-s3-backup,billturner/simple-s3-backup,423057.0,"A simple Ruby backup solution for MySQL & MongoDB databases, file directories, and single files to Amazon S3.",Ruby,116.0,66.0,18.0,66.0,database
5918,django-multidb,mmalone/django-multidb,192807.0,Simple example of using Django to work with multiple databases.,Python,84.0,66.0,2.0,66.0,database
5919,Silver,tpm/Silver,1299417.0,A light redis-backed database cacher and indexer,Ruby,152.0,66.0,1.0,66.0,database
5920,validates_lengths_from_database,rubiety/validates_lengths_from_database,1194453.0,Introspects your database string field maximum lengths and automatically defines length validations.,Ruby,65.0,65.0,12.0,65.0,database
5923,rdd,r043v/rdd,3488147.0,redis database dumper,C,229.0,65.0,8.0,65.0,database
5924,WebSQL,psayre23/WebSQL,3681646.0,A WebSQL library for easier local database queries,JavaScript,152.0,65.0,22.0,65.0,database
5927,WebKeePass,sukria/WebKeePass,8239287.0,Web interface over a KeePass database,Perl,565.0,65.0,10.0,65.0,database
5932,laravel,php-tmdb/laravel,23931866.0,Laravel Package for TMDB ( The Movie Database ) API. Provides easy access to the wtfzdotnet/php-tmdb-api library.,PHP,44.0,65.0,19.0,65.0,database
5933,laravel-db-normalizer,stidges/laravel-db-normalizer,17682419.0,"Normalize all database results to one unified interface, to make swapping repositories a breeze.",PHP,164.0,65.0,5.0,65.0,database
5934,mmoserverdb,swganh/mmoserverdb,615780.0,SWG:ANH - MMOServer Database,null,10198.0,64.0,47.0,64.0,database
5938,html5sql,KenCorbettJr/html5sql,1363963.0,A helper javascript module for creating and working with HTML5 Web Databases.,JavaScript,175.0,64.0,21.0,64.0,database
5939,EAVCleaner,magento-hackathon/EAVCleaner,36489795.0,"Clean up your Magento database by removing orphaned, unused and wrongly added attribute, attribute values and settings (for M1 & M2)",PHP,85.0,64.0,21.0,64.0,database
5941,database_validation,seejohnrun/database_validation,1258204.0,Automatic Rails validations from your database,Ruby,146.0,63.0,1.0,63.0,database
5942,dorks,USSCltd/dorks,58211701.0,google hack database automation tool,JavaScript,18.0,63.0,17.0,63.0,database
5943,sharedb-mongo,share/sharedb-mongo,10278193.0,MongoDB database adapter for ShareDB,JavaScript,249.0,63.0,28.0,63.0,database
5945,security-spr,Fruzenshtein/security-spr,9771869.0,"Maven Spring MVC Project with Security Spring integration. Hibernate as ORM, MySQL as database.",Java,174.0,63.0,127.0,63.0,database
5946,federal-treasury-api,csvsoundsystem/federal-treasury-api,9134978.0,"The scraper, parser, and database creation scripts for Financial Management Service daily U.S. Treasury statements.",Python,20925.0,63.0,10.0,63.0,database
5947,chef-hello-cloud,karmi/chef-hello-cloud,5793121.0,"A demo of a full stack Rails application deployment (1x load balancer, 3x appserver, 1x database, 3x elasticsearch) with Chef Server",Ruby,192.0,63.0,8.0,63.0,database
5948,wp-sweep,lesterchan/wp-sweep,31252139.0,"WP-Sweep allows you to clean up unused, orphaned and duplicated data in your WordPress. It also optimizes your database tables.",PHP,223.0,63.0,11.0,63.0,database
5949,databox-cookbook,teohm/databox-cookbook,8022279.0,Database chef cookbook,Ruby,244.0,62.0,23.0,62.0,database
5951,docker-neo4j,neo4j/docker-neo4j,34655771.0,Docker Images for the Neo4j Graph Database,Shell,266.0,62.0,34.0,62.0,database
5952,DBExecutor,LuckyJayce/DBExecutor,24017679.0,"android 数据库框架,sqlite database",HTML,1537.0,62.0,28.0,62.0,database
5954,mimic-code,MIT-LCP/mimic-code,41767943.0,MIMIC Code Repository: Code shared by the research community for the MIMIC-III database,HTML,9441.0,62.0,71.0,62.0,database
5956,web-server-backup,postpostmodern/web-server-backup,59671.0,A bash script for backing up MySQL databases and web site files (for cron),Shell,118.0,62.0,12.0,62.0,database
5958,Clairvoyant,jspahrsummers/Clairvoyant,38951328.0,Append-only key-value database,Swift,168.0,62.0,1.0,62.0,database
5959,migrate,ivpusic/migrate,46952469.0,Tool for managing and executing your database migrations,Ruby,28.0,62.0,1.0,62.0,database
5964,bootstrapper,sevenwire/bootstrapper,47913.0,A Rails plugin to assist in bootstrapping and seeding your database.,Ruby,87.0,61.0,20.0,61.0,database
5967,twitterstream-to-mongodb,gdelfresno/twitterstream-to-mongodb,2861231.0,Simple python script for storing tweets from the twitter stream directly to a MongoDB database based on a list of terms.,Python,171.0,61.0,18.0,61.0,database
5968,goim,BurntSushi/goim,16270314.0,Goim is a robust command line utility to maintain and query the Internet Movie Database (IMDb).,Go,249.0,61.0,3.0,61.0,database
5969,ripozo-oasis,timmartin19/ripozo-oasis,46644258.0,A package and tutorial for turning your database into a HATEOAS ReSTful application,Python,79.0,61.0,1.0,61.0,database
5971,PryNotes,derek3x/PryNotes,17215051.0,"Web based note application. Save your ideas, notes, todo lists, recipes, news articles or anything you find online. Keep it safe and secure with encryption and in a database that won't be mined or sold.",CSS,2386.0,61.0,2.0,61.0,database
5972,victims-cve-db,victims/victims-cve-db,13849704.0,CVE database store,Python,174.0,60.0,24.0,60.0,database
5974,XPL-SEARCH,CoderPirata/XPL-SEARCH,38467402.0,Search exploits in multiple exploit databases!,PHP,64.0,60.0,22.0,60.0,database
5975,docker-dbaas,abulte/docker-dbaas,12076280.0,Docker Databases As A Service,CSS,858.0,60.0,11.0,60.0,database
5976,thin-pdo-wrapper,mikehenrty/thin-pdo-wrapper,1933455.0,A simple database client utilizing PHP PDO.,PHP,27.0,60.0,32.0,60.0,database
5977,bitstarter-ssjs-db,startup-class/bitstarter-ssjs-db,11990319.0,"Very simple SSJS app that writes crowdfunder preorders to a local database. Uses Sequelize, Express, Async.",JavaScript,162.0,60.0,329.0,60.0,database
5978,shmig,naquad/shmig,13263886.0,Database migration tool written in BASH.,Shell,51.0,60.0,13.0,60.0,database
5980,vdbi-vim,mattn/vdbi-vim,3646840.0,Database client for Vim,VimL,176.0,60.0,5.0,60.0,database
5981,rrdtool-2.x,oetiker/rrdtool-2.x,5674445.0,RRDtool 2.x - The Time Series Database,Perl,1449.0,60.0,9.0,60.0,database
5983,sqlserver-kit,ktaranov/sqlserver-kit,24328843.0,"Useful links, scripts, tools and best practice for Microsoft SQL Server Database",SQLPL,7515.0,60.0,22.0,60.0,database
5989,craftimport,clearbold/craftimport,15087336.0,"It's just starter code; Get in touch if you need help with an import from EE, WordPress, etc. Craft Import is available as a starting point for your own work, with XML & ExpressionEngine template examples. Need help? Get in touch at clearbold.com to book an import to your database from WordPress or EE.",PHP,28.0,60.0,6.0,60.0,database
5990,NameDatabases,enorvelle/NameDatabases,15067042.0,Text databases of last names from various countries,null,1620.0,59.0,37.0,59.0,database
5991,spring-boot-oauth2,rajithd/spring-boot-oauth2,44375034.0,Spring Boot Oauth2 with H2 database,Java,0.0,59.0,66.0,59.0,database
5992,ebib,joostkremers/ebib,1207060.0,A BibTeX database manager for Emacs.,Emacs Lisp,6022.0,59.0,16.0,59.0,database
5993,lua-db,cloudwu/lua-db,4073618.0,A database shared data among multi-states .,C,73.0,59.0,14.0,59.0,database
5998,read_from_slave,sdsykes/read_from_slave,240519.0,"Read_from_slave for Rails enables database reads from a slave database, while writes continue to go to the master",Ruby,153.0,59.0,8.0,59.0,database
5999,PyTd,Teradata/PyTd,38783612.0,A Python Module to make it easy to script powerful interactions with Teradata Database in a DevOps friendly way.,Python,195.0,59.0,16.0,59.0,database
6011,melonJS,melonjs/melonJS,1597789.0,a fresh & lightweight javascript game engine,CSS,64190.0,1672.0,381.0,1672.0,game engine
6012,piston,PistonDevelopers/piston,19102672.0,A modular game engine written in Rust,Rust,4689.0,1417.0,116.0,1417.0,game engine
6019,flixel,HaxeFlixel/flixel,2101031.0,"Free, cross-platform 2D game engine powered by Haxe and OpenFL",Haxe,32269.0,907.0,224.0,907.0,game engine
6022,hematite,PistonDevelopers/hematite,21311275.0,A simple Minecraft written in Rust with the Piston game engine,Rust,8390.0,771.0,74.0,771.0,game engine
6036,Nu,bryanedds/Nu,11965691.0,Repository hosting the open-source Nu Game Engine and related projects.,F#,793903.0,419.0,46.0,419.0,game engine
6040,qiciengine,qiciengine/qiciengine,47888260.0,A free JavaScript game engine library with a web-based comprehensive suite of toolset for making HTML5 games. http://www.qiciengine.com,null,382382.0,370.0,56.0,370.0,game engine
6042,mage,magefree/mage,4158448.0,Magic Another Game Engine,Java,448782.0,362.0,240.0,362.0,game engine
6046,amethyst,amethyst/amethyst,48364554.0,Data-oriented game engine written in Rust,Rust,14725.0,334.0,28.0,334.0,game engine
6047,Dash,Circular-Studios/Dash,15827539.0,A free and open 3D game engine written in D.,D,36327.0,322.0,57.0,322.0,game engine
6053,luxe,underscorediscovery/luxe,10870200.0,A cross platform game engine written in haxe,Haxe,115390.0,282.0,62.0,282.0,game engine
6055,grid-sdk,Planimeter/grid-sdk,25402523.0,The Grid SDK - A 2D game engine built on LÖVE,Lua,30387.0,271.0,25.0,271.0,game engine
6072,PyDark,SirFroweey/PyDark,26162682.0,PyDark is a 2D and Online Multiplayer video game engine written on-top of Python and PyGame.,Python,102.0,176.0,13.0,176.0,game engine
6080,Advanced-Tiled-Loader,Kadoba/Advanced-Tiled-Loader,2229838.0,Imports Tiled maps into Lua for the LÖVE game engine. (NO LONGER IN DEVELOPMENT),Lua,3596.0,161.0,25.0,161.0,game engine
6085,cyo,danielstern/cyo,13492683.0,100% HTML Game Engine,CSS,4213.0,144.0,12.0,144.0,game engine
6089,finalengine,kamibu/finalengine,2113933.0,A WebGL game engine,JavaScript,12689.0,131.0,8.0,131.0,game engine
6100,node-poker,mjhbell/node-poker,3198742.0,Texas Holdem game engine,JavaScript,219.0,111.0,55.0,111.0,game engine
6108,pulse,onmodulus/pulse,2463210.0,HTML5 & JavaScript Game Engine,JavaScript,171684.0,97.0,18.0,97.0,game engine
6109,piston-examples,PistonDevelopers/piston-examples,21298530.0,A collection of examples using the Piston game engine,Rust,2545.0,95.0,55.0,95.0,game engine
6115,yae,nondev/yae,25915873.0,"Windows/Linux/Mac/Android/iOS/Ouya game engine for MoonScript, in MoonScript.",MoonScript,68593.0,91.0,5.0,91.0,game engine
6121,Firmament,martamius/Firmament,10805178.0,Firmament Game Engine,Haxe,19014.0,86.0,25.0,86.0,game engine
6123,ProceduralMesh,mortennobel/ProceduralMesh,1103612.0,Simple procedural mesh generation for the Unity 3 game engine,C#,149.0,86.0,25.0,86.0,game engine
6125,Dusk-Engine,GymbylCoding/Dusk-Engine,7943978.0,"Dusk is a fully-featured, open-source game engine for Corona SDK.",Lua,3894.0,83.0,34.0,83.0,game engine
6127,rust-2048,coeuvre/rust-2048,19941072.0,A 2048 clone with Piston game engine,Rust,357.0,80.0,16.0,80.0,game engine
6129,Clarity,Dissimulate/Clarity,14575927.0,"A simple, customisable and scriptable platform game engine.",JavaScript,98.0,77.0,28.0,77.0,game engine
6139,TD-Godot-Games,TutorialDoctor/TD-Godot-Games,43176521.0,A collection of games made with the Godot game engine,HTML,307106.0,71.0,20.0,71.0,game engine
6140,Unity-Beat-Detection,allanpichardo/Unity-Beat-Detection,30501529.0,Musical beat detection and audio spectrum analysis for use with the Unity game engine.,C#,9.0,71.0,19.0,71.0,game engine
6144,Miners,Charged/Miners,1689237.0,An Game Engine and Minecraft Classic Client,D,3988.0,69.0,10.0,69.0,game engine
6148,anima-engine,anima-engine/anima-engine,50508100.0,The quirky game engine,Rust,123.0,66.0,3.0,66.0,game engine
6149,PixelSpriteGenerator-Unity,Shogan/PixelSpriteGenerator-Unity,48873183.0,A port of the PixelSpriteGenerator to C# for use with the Unity3D game engine,C#,25.0,66.0,8.0,66.0,game engine
6154,HGE2D,I3ck/HGE2D,50943151.0,2D game engine written in Haskell,Haskell,114.0,63.0,4.0,63.0,game engine
6155,play_phaser,playif/play_phaser,21606087.0,A Dart port for Phaser 2D game engine.,Dart,60899.0,62.0,15.0,62.0,game engine
6161,TauEngine,ianterrell/TauEngine,2781564.0,2D game engine built on iOS 5's GLKit,Objective-C,155.0,59.0,7.0,59.0,game engine
6162,haxor-engine,haxorplatform/haxor-engine,21256983.0,Haxe free cross platform 3D Game Engine,Haxe,152804.0,59.0,6.0,59.0,game engine
6170,Roll-a-ball-FSharp,Thorium/Roll-a-ball-FSharp,29443854.0,Unity 3d game engine tutorial,F#,323.0,54.0,3.0,54.0,game engine
6171,impact-tween,nefD/impact-tween,1370462.0,Tweening plugin for the ImpactJS game engine,JavaScript,116.0,53.0,9.0,53.0,game engine
6172,Hatchit,thirddegree/Hatchit,48081064.0,An Open Source 3D Game Engine written in C++,CMake,11906.0,53.0,11.0,53.0,game engine
6175,dynadungeons,akien-mga/dynadungeons,35509227.0,Bomberman clone using the awesome open source Godot game engine,GDScript,5049.0,53.0,7.0,53.0,game engine
6176,game-engines,sourceful/game-engines,21884775.0,HTML5 Game Engines,null,140.0,52.0,4.0,52.0,game engine
6187,CitruxEngine,alamboley/CitruxEngine,3860085.0,2D Haxe NME Game Engine,HaXe,15009.0,44.0,10.0,44.0,game engine
6189,Flixel-Haxe,domrein/Flixel-Haxe,1004950.0,Port of Flixel game engine to haXe with a focus on iOS development,HaXe,346.0,44.0,4.0,44.0,game engine
6195,impact-box2d,phoboslab/impact-box2d,1345693.0,Box2D Plugin for the Impact Game Engine,JavaScript,183.0,43.0,13.0,43.0,game engine
6202,unity3d-extensions,jbruening/unity3d-extensions,7446860.0,extension and utility methods for the Unity game engine,C#,229.0,41.0,9.0,41.0,game engine
6205,Unity-TaskManager,krockot/Unity-TaskManager,1943851.0,"An tiny, improved coroutine API for the Unity game engine.",C#,108.0,40.0,24.0,40.0,game engine
6209,dreamengine,afflicto/dreamengine,8638517.0,html5 canvas game engine,JavaScript,8720.0,39.0,15.0,39.0,game engine
6210,TERRA-Engine,Relfos/TERRA-Engine,27311225.0,Cross platform game engine written in Object Pascal.,Pascal,71942.0,39.0,24.0,39.0,game engine
6211,FlappyBird,V-Play/FlappyBird,16705004.0,Source code of Flappy Bird version created with V-Play Game Engine,QML,2011.0,39.0,50.0,39.0,game engine
6212,impactConnect,cdreier/impactConnect,2972035.0,nodeJS plugin for impactjs game engine,JavaScript,108.0,39.0,10.0,39.0,game engine
6215,cleven,afainer/cleven,44600528.0,Cleven is an experimental game engine with volume graphics written in Common Lisp.,Common Lisp,1524.0,38.0,2.0,38.0,game engine
6216,sathra-2d,mmoczkowski/sathra-2d,18381840.0,An open source 2D Game Engine for Android.,HTML,6010.0,38.0,0.0,38.0,game engine
6217,stratagus,Wargus/stratagus,46500717.0,The Stratagus strategy game engine,C++,379849.0,37.0,15.0,37.0,game engine
6219,FriceEngine,icela/FriceEngine,65617268.0,"An easy, light, native game engine running on JVM",Kotlin,460.0,37.0,3.0,37.0,game engine
6221,ammo,BlackBulletIV/ammo,1679273.0,"A simple, flexible organisational library for use with the LÖVE game engine.",Lua,139.0,37.0,0.0,37.0,game engine
6223,LOVE-Adventure-Game-Engine,Jasoco/LOVE-Adventure-Game-Engine,809827.0,"An unfinished adventure game engine in the style of Zelda and modern real-time battle RPG's. To be finished sometime in 2015. Just in time for flying cars, power laces and self-drying jackets. Built with the awesome Lua-powered LÖVE 2D game development tool.",Lua,26270.0,36.0,2.0,36.0,game engine
6227,moon,polyfox/moon,11409007.0,"2D game engine, with a mruby scripting system.",C++,10042.0,36.0,3.0,36.0,game engine
6232,swift-engine,thelukester92/swift-engine,20608959.0,An entity-component-system game engine built in the Swift programming language.,Swift,1700.0,34.0,6.0,34.0,game engine
6233,Director,boneheadmed/Director,1263585.0,A Director plugin to be used with the Impact javascript game engine.,JavaScript,106.0,34.0,6.0,34.0,game engine
6235,j2objc-sample-reversi,tomball/j2objc-sample-reversi,18279466.0,A sample showing how to use a Reversi game engine in an iOS app using J2ObjC.,Java,102.0,33.0,11.0,33.0,game engine
6236,AnvilClient,AnvilOnline/AnvilClient,44775425.0,The main C++ module to take control and expand the running game engine.,null,85858.0,33.0,7.0,33.0,game engine
6240,blackjack,ChrisZieba/blackjack,32962531.0,A small game engine for casino blackjack and a library for calculating hand probabilities.,JavaScript,204.0,32.0,12.0,32.0,game engine
6246,PGE,222464/PGE,57993134.0,PGE: Parallel Game Engine,C++,48598.0,31.0,4.0,31.0,game engine
6249,moirai,frostney/moirai,31283069.0,":black_joker: React.js game engine. Exciting, experimental and unstable",JavaScript,112.0,31.0,2.0,31.0,game engine
6259,passion,kikito/passion,622364.0,An object-oriented LÖVE game engine,Lua,702.0,30.0,1.0,30.0,game engine
6262,npos3d,AdmiralPotato/npos3d,3008485.0,Vector 3D game engine written in Javascript and HTML5's 2D Canvas context ,HTML,18820.0,30.0,4.0,30.0,game engine
6264,engine,rools/engine,12528048.0,Entity-component-system based 3D game engine,C++,212.0,29.0,13.0,29.0,game engine
6268,hxdefold,hxdefold/hxdefold,60483806.0,Haxe/Lua externs for Defold game engine,Haxe,364.0,29.0,2.0,29.0,game engine
6270,simplecs,s-k/simplecs,9839406.0,Simplecs is a Component-Entity-System game engine used to write games in a modular fashion.,Clojure,152.0,29.0,2.0,29.0,game engine
6272,AGE,po8rewq/AGE,4565651.0,Another Game Engine,Haxe,2259.0,28.0,3.0,28.0,game engine
6276,MalletEngine,rforshaw/MalletEngine,10629548.0,"A powerful entity-component game-engine and editor, based on a modular design. Available on Linux, Windows, Mac, Android, and iOS.",HTML,32902.0,28.0,2.0,28.0,game engine
6279,feedback,FeedBackDevs/feedback,15641649.0,FeedBack - Music & Rhythm Game Engine,D,3231.0,27.0,2.0,27.0,game engine
6281,unecht,Extrawurst/unecht,30955821.0,Game Engine Framework for the D programming language,D,20073.0,27.0,3.0,27.0,game engine
6283,LoveAStar,mkosler/LoveAStar,3175565.0,"A* search, written in Lua, for use in the LOVE 2D game engine",Lua,152.0,27.0,5.0,27.0,game engine
6284,add_primitives,TheHX/add_primitives,31269211.0,"A plugin for the Godot Game Engine, capable of generating simple meshes for your game",GDScript,529.0,27.0,3.0,27.0,game engine
6285,SmallGameEngine,eXpl0it3r/SmallGameEngine,5051337.0,A small game engine or better said a state machine.,C++,197.0,26.0,8.0,26.0,game engine
6287,castle-engine,castle-engine/castle-engine,30114388.0,Castle Game Engine code and examples,Pascal,256456.0,26.0,4.0,26.0,game engine
6288,gin,huandu/gin,1298362.0,gin - a simple & efficient HTML5 game engine,JavaScript,162.0,26.0,2.0,26.0,game engine
6292,GodotSteam,Mavhod/GodotSteam,46160848.0,Steam api for Godot game engine,Python,66.0,25.0,10.0,25.0,game engine
6297,phaser-shim,amowu/phaser-shim,46268520.0,"A shim to make Phaser HTML5 game engine from NPM work with Webpack, and build properly.",JavaScript,7.0,25.0,2.0,25.0,game engine
6303,pyGrid,GordonZed/pyGrid,9044527.0,Grid based Game Engine for Python+Pygame,Python,54.0,24.0,4.0,24.0,game engine
6305,ignifuga,gabomdq/ignifuga,7673412.0,Ignifuga Game Engine,C++,40213.0,24.0,1.0,24.0,game engine
6306,flaxen,scriptorum/flaxen,15014478.0,Haxe game engine with entity component system,Haxe,2285.0,24.0,2.0,24.0,game engine
6308,voxelman,MrSmith33/voxelman,21798503.0,Plugin-based client-server voxel game engine written in D language,D,1176.0,24.0,1.0,24.0,game engine
6309,VixenEngine,MattGuerrette/VixenEngine,36013505.0,Open Source C++ Game Engine,HTML,110462.0,23.0,7.0,23.0,game engine
6310,Engine,Shervanator/Engine,18516055.0,A basic cross-platform 3D game engine,C,6516.0,23.0,10.0,23.0,game engine
6311,flickgame,increpare/flickgame,34676954.0,tiny game engine,HTML,359.0,23.0,2.0,23.0,game engine
6313,until-it-dies,zkat/until-it-dies,203321.0,A batteries-included game engine.,Common Lisp,1238.0,23.0,2.0,23.0,game engine
6314,mario-game,arjanfrans/mario-game,22395360.0,:mushroom: Super Mario Bros 16-bit version clone. Written in Java and using the LibGdx game engine.,null,14009.0,23.0,18.0,23.0,game engine
6315,Begame,pepijndevos/Begame,1595414.0,A Clojure 2D game engine,Clojure,137.0,23.0,1.0,23.0,game engine
6317,silverscreen,mminer/silverscreen,932472.0,Editor tools for creating cinematics using the Unity game engine.,C#,239.0,23.0,2.0,23.0,game engine
