,name,full_name,id,description,language,size,watchers,forks,stargazers_count,group
1987,js-richtext,joshmarinacci/js-richtext,26739831.0,Rich Text editor for HTML Canvas and others.,JavaScript,176.0,2.0,0.0,2.0,text editor
1988,automatic-octo-computing-machine,eriklovlie/automatic-octo-computing-machine,51029383.0,OCaml linter for the Atom text editor.,CoffeeScript,28.0,2.0,1.0,2.0,text editor
1989,zile,Etenil/zile,47848.0,zile is an emacs-like text editor,null,56.0,2.0,0.0,2.0,text editor
1990,idiomatic-dark-syntax,blaqbern/idiomatic-dark-syntax,43584775.0,A minimal syntax theme for Atom text editor,CSS,1104.0,2.0,1.0,2.0,text editor
1991,chocula-syntax,SeanJM/chocula-syntax,40413955.0,A Syntax theme for the Atom text editor,CSS,11804.0,2.0,0.0,2.0,text editor
1993,EditorialWorkflows,jobbogamer/EditorialWorkflows,16697020.0,"Workflows for Editorial, the text editor for iPad.",null,140.0,2.0,0.0,2.0,text editor
1994,woot,mkdynamic/woot,62530995.0,Collaborative text editor using the WOOT algorithm,JavaScript,18.0,2.0,0.0,2.0,text editor
1995,finpad,drcouzelis/finpad,37283592.0,A simple text editor for SailfishOS (TinyEdit fork),QML,148.0,2.0,0.0,2.0,text editor
1998,scum,CCareaga/scum,67505798.0,"A multi-tab, terminal-based text editor",Python,140.0,2.0,0.0,2.0,text editor
1999,emacs,id774-2/emacs,914403.0,"GNU Emacs is an extensible, customizable text editor—and more.",Emacs Lisp,55468.0,2.0,0.0,2.0,text editor
2003,emscripten,kripken/emscripten,1357796.0,Emscripten: An LLVM-to-JavaScript Compiler,C,172695.0,10634.0,1327.0,10634.0,compiler
2004,marked,chjj/marked,2096579.0,A markdown parser and compiler. Built for speed.,HTML,1758.0,10430.0,1486.0,10430.0,compiler
2009,the-super-tiny-compiler,thejameskyle/the-super-tiny-compiler,53639099.0,:snowman: Possibly the smallest compiler ever,JavaScript,72.0,5779.0,342.0,5779.0,compiler
2015,Batsh,BYVoid/Batsh,12537898.0,A language that compiles to Bash and Windows Batch,OCaml,598.0,3170.0,154.0,3170.0,compiler
2017,Nim,nim-lang/Nim,842037.0,"Nim (formerly known as ""Nimrod"") is a compiled, garbage-collected systems programming language which has an excellent productivity/performance ratio. Nim's design focuses on efficiency, expressiveness, elegance (in the order of priority).",Nimrod,355358.0,3078.0,422.0,3078.0,compiler
2021,ruby-build,rbenv/ruby-build,2142701.0,Compile and install Ruby,Shell,2349.0,2524.0,508.0,2524.0,compiler
2032,LiveScript,gkz/LiveScript,3322086.0,"LiveScript is a language which compiles to JavaScript. It has a straightforward mapping to JavaScript and allows you to write expressive code devoid of repetitive boilerplate. While LiveScript adds many features to assist in functional style programming, it also has many improvements for object oriented and imperative programming. ",LiveScript,23142.0,1779.0,142.0,1779.0,compiler
2033,gox,mitchellh/gox,14460330.0,"A dead simple, no frills Go cross compile tool",Go,112.0,1752.0,113.0,1752.0,compiler
2036,legacy-cc,mortdeus/legacy-cc,8502433.0,The earliest versions of the very first c compiler known to exist in the wild written by the late legend himself dmr. ,C,185.0,1547.0,197.0,1547.0,compiler
2038,bucklescript,bloomberg/bucklescript,49159983.0,A backend for the OCaml compiler which emits JavaScript.,OCaml,44054.0,1445.0,80.0,1445.0,compiler
2041,c,ryanmjacobs/c,31526549.0,"Compile and execute C ""scripts"" in one go!",Shell,185.0,1375.0,108.0,1375.0,compiler
2046,fsharp,fsharp/fsharp,1162709.0,"The Open Edition of the F# compiler, core library and tools",F#,153757.0,1334.0,259.0,1334.0,compiler
2049,moonscript,leafo/moonscript,1786885.0,:crescent_moon: A language that compiles to Lua,Lua,3221.0,1325.0,112.0,1325.0,compiler
2050,dmd,dlang/dmd,1257070.0,dmd D Programming Language compiler,D,88920.0,1279.0,371.0,1279.0,compiler
2051,dragon-book-exercise-answers,fool2fish/dragon-book-exercise-answers,7474917.0,"Compilers Principles, Techniques, & Tools (purple dragon book) second edition exercise answers. 编译原理（紫龙书）第2版习题答案。",HTML,1593.0,1247.0,482.0,1247.0,compiler
2054,red,red/red,1449773.0,"Red is a next-generation programming language strongly inspired by Rebol, but with a broader field of usage thanks to its native-code compiler, from system programming to high-level scripting and cross-platform reactive GUI, while providing modern support for concurrency, all in a zero-install, zero-config, single 1MB file!",Red,18813.0,1146.0,161.0,1146.0,compiler
2056,OpenSSL-for-iPhone,x2on/OpenSSL-for-iPhone,502238.0,"A script for compiling OpenSSL for iOS Devices (iPhone, iPad, iPod Touch, AppleTV)",Shell,7395.0,1120.0,375.0,1120.0,compiler
2064,Arduino-Makefile,sudar/Arduino-Makefile,3570431.0,"Makefile for Arduino sketches. It defines the workflows for compiling code, flashing it to Arduino and even communicating through Serial.",Makefile,1967.0,988.0,275.0,988.0,compiler
2065,ocaml,ocaml/ocaml,6786166.0,"The core OCaml system: compilers, runtime system, base libraries",OCaml,248509.0,927.0,281.0,927.0,compiler
2066,grunt-sass,sindresorhus/grunt-sass,4641160.0,Compile Sass to CSS,JavaScript,228.0,917.0,173.0,917.0,compiler
2067,closure-compiler-js,google/closure-compiler-js,63377929.0,Package for the JS version of closure-compiler for use via npm,JavaScript,39.0,912.0,19.0,912.0,compiler
2068,PlacesToPostYourStartup,mmccaff/PlacesToPostYourStartup,16894772.0,"Compiled list of links from ""Ask HN: Where can I post my startup to get beta users?""",null,48.0,912.0,118.0,912.0,compiler
2069,luafun,rtsisyk/luafun,14534744.0,Lua Fun is a high-performance functional programming library for Lua designed with LuaJIT's trace compiler in mind.,Lua,493.0,900.0,44.0,900.0,compiler
2070,rebar,rebar/rebar,6393199.0,"Deprecated Erlang build tool that makes it easy to compile and test Erlang applications, port drivers and releases. We encourage you to move to https://github.com/erlang/rebar3.",Erlang,3996.0,897.0,284.0,897.0,compiler
2071,texlive.js,manuels/texlive.js,7656304.0,Compiling LaTeX (TeX live) in your browser,TeX,304278.0,881.0,69.0,881.0,compiler
2073,binaryen,WebAssembly/binaryen,45208608.0,"Compiler infrastructure and toolchain library for WebAssembly, in C++",Assembly,34257.0,858.0,75.0,858.0,compiler
2076,visualfsharp,Microsoft/visualfsharp,29048891.0,The Visual F# compiler and tools,F#,238590.0,832.0,206.0,832.0,compiler
2077,swift-compiler-crashes,practicalswift/swift-compiler-crashes,23238061.0,A collection of test cases crashing the Swift compiler.,Swift,41865.0,791.0,83.0,791.0,compiler
2080,enclave,eanplatter/enclave,53015094.0,A simpler way to compile React applications http://enclave.js.org,JavaScript,157.0,770.0,30.0,770.0,compiler
2083,Mu,raycmorgan/Mu,488856.0,A Node.js Mustache template engine (and compiler),JavaScript,188.0,733.0,86.0,733.0,compiler
2099,timl,tpope/timl,14607753.0,Clojure like language which compiles down to VimL,VimL,1572.0,586.0,18.0,586.0,compiler
2103,rhine-ml,artagnon/rhine-ml,22042992.0,an OCaml compiler for an untyped lisp,OCaml,2147.0,565.0,21.0,565.0,compiler
2109,pyScss,Kronuz/pyScss,1326634.0,"pyScss, a Scss compiler for Python",CSS,3652.0,526.0,124.0,526.0,compiler
2111,Fable,fable-compiler/Fable,49417923.0,F# to JavaScript Compiler,F#,25358.0,502.0,67.0,502.0,compiler
2112,ldc,ldc-developers/ldc,2174666.0,The LLVM-based D compiler.,D,29935.0,491.0,103.0,491.0,compiler
2116,rebar3,erlang/rebar3,26610130.0,Erlang build tool that makes it easy to compile and test Erlang applications and releases.,Erlang,9360.0,473.0,160.0,473.0,compiler
2118,Open-Source-FPGA-Bitcoin-Miner,progranism/Open-Source-FPGA-Bitcoin-Miner,1774473.0,"A completely open source implementation of a Bitcoin Miner for Altera and Xilinx FPGAs. This project hopes to promote the free and open development of FPGA based mining solutions and secure the future of the Bitcoin project as a whole. A binary release is currently available for the Terasic DE2-115 Development Board, and there are compile-able projects for numerous boards.",VHDL,9382.0,458.0,240.0,458.0,compiler
2123,ffmpeg-android,WritingMinds/ffmpeg-android,20399893.0,"FFmpeg for Android compiled with x264, libass, fontconfig, freetype, fribidi and lame (Supports Android 4.1+)",Shell,27376.0,446.0,181.0,446.0,compiler
2124,opam,ocaml/opam,3473767.0,"OPAM is a source-based package manager for OCaml. It supports multiple simultaneous compiler installations, flexible package constraints, and a Git-friendly development workflow.",OCaml,32130.0,444.0,148.0,444.0,compiler
2126,FunScript,ZachBray/FunScript,6663589.0,F# to JavaScript compiler with JQuery etc. mappings through a TypeScript type provider,F#,63696.0,436.0,102.0,436.0,compiler
2127,staticfiles,bouk/staticfiles,65221780.0,staticfiles compiles a directory of files into an embeddable .go file,Go,136.0,431.0,7.0,431.0,compiler
2138,DataScienceSpCourseNotes,sux13/DataScienceSpCourseNotes,31872332.0,Compiled Notes for all 9 courses in the Coursera Data Science Specialization,HTML,142925.0,374.0,1946.0,374.0,compiler
2139,go-fast,kovetskiy/go-fast,65213702.0,Compile Go programs 7x faster,Shell,3.0,372.0,11.0,372.0,compiler
2143,my_toy_compiler,lsegal/my_toy_compiler,311121.0,My Toy Compiler. Read about how I did it at the homepage URL,C++,60.0,358.0,117.0,358.0,compiler
2144,c6,c9s/c6,34741977.0,Compile SASS Faster ! C6 is a SASS-compatible compiler,CMake,966.0,358.0,19.0,358.0,compiler
2145,less.js-windows,duncansmart/less.js-windows,1493563.0,A way to run the LESS.js compiler in windows,Batchfile,2380.0,348.0,86.0,348.0,compiler
2147,rust-cross,japaric/rust-cross,50153389.0,Everything you need to know about cross compiling Rust programs!,Shell,46.0,341.0,17.0,341.0,compiler
2152,gulp-pug,jamen/gulp-pug,11210841.0,Gulp plugin for compiling Pug templates,JavaScript,91.0,333.0,56.0,333.0,compiler
2162,grunt-contrib-pug,gruntjs/grunt-contrib-pug,5723015.0,Compile Pug templates.,JavaScript,220.0,307.0,74.0,307.0,compiler
2165,sibilant,jbr/sibilant,757109.0,Just another compile-to-js lang,JavaScript,5145.0,304.0,40.0,304.0,compiler
2167,jscl,jscl-project/jscl,7440652.0,A Lisp-to-Javascript compiler bootstrapped from Common Lisp,Common Lisp,3517.0,303.0,64.0,303.0,compiler
2169,pipe2py,ggaughan/pipe2py,553348.0,A project to compile Yahoo! Pipes into Python (see it hosted on Google App Engine: http://pipes-engine.appspot.com),HTML,1534.0,302.0,49.0,302.0,compiler
2170,golang-builder,CenturyLinkLabs/golang-builder,29882058.0,Containerized build environment for compiling an executable Golang package and packaging it in a light-weight Docker container.,Shell,42.0,299.0,40.0,299.0,compiler
2172,rock,ooc-lang/rock,221032.0,:ocean: self-hosted ooc compiler that generates c99,ooc,17970.0,295.0,38.0,295.0,compiler
2175,amacc,jserv/amacc,50844155.0,Small C Compiler generating ELF executable for ARM architecture,C,129.0,286.0,71.0,286.0,compiler
2182,GDC,D-Programming-GDC/GDC,3759178.0,GNU D Compiler,D,90757.0,276.0,48.0,276.0,compiler
2184,js_of_ocaml,ocsigen/js_of_ocaml,11749064.0,Compiler from OCaml to Javascript.,OCaml,57724.0,271.0,70.0,271.0,compiler
2191,pyv8-binaries,emmetio/pyv8-binaries,6492027.0,Archive of pre-compiled PyV8 binaries,null,69154.0,265.0,110.0,265.0,compiler
2194,kind-projector,non/kind-projector,3533170.0,Compiler plugin for making type lambdas (type projections) easier to write,Scala,141.0,263.0,19.0,263.0,compiler
2195,less.js-middleware,emberfeather/less.js-middleware,3811969.0,Connect Middleware for LESS.js compiling,JavaScript,217.0,263.0,84.0,263.0,compiler
2196,tagua-vm,tagua-vm/tagua-vm,51442464.0,Tagua VM is an experimental PHP Virtual Machine that guarantees safety and quality by removing large classes of vulnerabilities thanks to the Rust language and the LLVM Compiler Infrastructure.,Rust,3523.0,263.0,13.0,263.0,compiler
2202,luajit-lang-toolkit,franko/luajit-lang-toolkit,16670536.0,A Lua bytecode compiler written in Lua itself for didactic purposes or for new language implementations,Lua,444.0,258.0,27.0,258.0,compiler
2206,LinqOptimizer,nessos/LinqOptimizer,11924508.0,An automatic query optimizer-compiler for Sequential and Parallel LINQ.,F#,2223.0,251.0,22.0,251.0,compiler
2212,karma-ng-html2js-preprocessor,karma-runner/karma-ng-html2js-preprocessor,7996482.0,A Karma plugin. Compile AngularJS 1.x and 2.x templates to JavaScript on the fly.,CoffeeScript,113.0,243.0,112.0,243.0,compiler
2213,crenshaw-go,dcw303/crenshaw-go,57942875.0,A Go implementation of Jack Crenshaw's Let's Build a Compiler tutorial series,Go,32.0,242.0,17.0,242.0,compiler
2218,angular-2-beta-boilerplate,mschwarzmueller/angular-2-beta-boilerplate,49139869.0,A basic boilerplate to start an Angular 2 (Beta) App. Includes Gulpfile to compile Typescript and SCSS.,JavaScript,41.0,234.0,218.0,234.0,compiler
2219,Perlito,fglock/Perlito,393344.0,Perl 5 and Perl 6 compilers,Perl,43410.0,231.0,24.0,231.0,compiler
2222,grunt-traceur,aaronfrost/grunt-traceur,8301541.0,This is a grunt task for adding a grunt task to compiler ES6 JS into ES3 JS using Traceur Compiler,JavaScript,203.0,228.0,36.0,228.0,compiler
2223,data-police-shootings,washingtonpost/data-police-shootings,38310038.0,The Washington Post is compiling a database of every fatal shooting in the United States by a police officer in the line of duty in 2015 and 2016.,null,1136.0,228.0,61.0,228.0,compiler
2224,opendylan,dylan-lang/opendylan,1441721.0,Open Dylan compiler and IDE,Dylan,88174.0,227.0,50.0,227.0,compiler
2225,CompCert,AbsInt/CompCert,24187206.0,The CompCert C verified compiler,Coq,14916.0,227.0,33.0,227.0,compiler
2237,inc,namin/inc,2984078.0,an incremental approach to compiler construction,Scheme,1007.0,213.0,31.0,213.0,compiler
2238,nanopass-framework,akeep/nanopass-framework,7204733.0,The new nanopass framework; an embedded DSL for writing compilers in Scheme,Scheme,27347.0,213.0,38.0,213.0,compiler
2239,hermetic,alehander42/hermetic,29101908.0,"a python-like language with hindley-milner-like type system, which is compiled to c",Python,55.0,213.0,7.0,213.0,compiler
2245,xgo,karalabe/xgo,22697833.0,Go CGO cross compiler,Shell,468.0,206.0,28.0,206.0,compiler
2246,css-modules-require-hook,css-modules/css-modules-require-hook,38828181.0,A require hook to compile CSS Modules in runtime,JavaScript,164.0,206.0,12.0,206.0,compiler
2247,Horrible.js,TShadwell/Horrible.js,4463186.0,A Javascript compiler that does horrible things to javascript.,null,211.0,204.0,16.0,204.0,compiler
2251,awesome-rubies,planetruby/awesome-rubies,34689223.0,"A collection of awesome Rubies (compilers, interpreters, virtual machines, parsers, doc generators, version managers, etc.) ",null,19.0,200.0,13.0,200.0,compiler
2258,quickstart,spotify/quickstart,21179790.0,"A CommonJS module resolver, loader and compiler for node.js and browsers.",JavaScript,86.0,194.0,10.0,194.0,compiler
2259,sublime-less2css,timdouglas/sublime-less2css,5233440.0,Sublime Text 2 Plugin to compile less files to css on save,Python,143.0,194.0,67.0,194.0,compiler
2260,goupx,pwaller/goupx,5728942.0,Fix golang compiled binaries on x86_64 so that they can be packed with UPX,Go,15.0,194.0,10.0,194.0,compiler
2261,ikiwiki,joeyh/ikiwiki,32207.0,a wiki compiler,Perl,36505.0,193.0,59.0,193.0,compiler
2263,rperl,wbraswell/rperl,7436032.0,RPerl Compiler,Perl,42090.0,192.0,24.0,192.0,compiler
2265,mini-c,Fedjmike/mini-c,36145590.0,"Dr Strangehack, or: how to write a self-hosting C compiler in 10 hours",C,100.0,191.0,18.0,191.0,compiler
2267,rust-on-raspberry-pi,Ogeon/rust-on-raspberry-pi,32486935.0,Instructions for how to cross compile Rust projects for the Raspberry Pi,Shell,24.0,187.0,16.0,187.0,compiler
2271,jclasslib,ingokegel/jclasslib,2788710.0,jclasslib bytecode viewer is a tool that visualizes all aspects of compiled Java class files and the contained bytecode.,Kotlin,9034.0,185.0,78.0,185.0,compiler
2275,pyflakes,kevinw/pyflakes,65099.0,a faster smurfier pyflakes fork using _ast instead of compiler,Python,219.0,181.0,59.0,181.0,compiler
2278,the-super-tiny-compiler,hazbo/the-super-tiny-compiler,56237170.0,"Like The Super Tiny Compiler, but in Go",Go,21.0,180.0,12.0,180.0,compiler
2279,gulp-traceur,sindresorhus/gulp-traceur,15361133.0,Traceur is a JavaScript.next to JavaScript-of-today compiler,JavaScript,66.0,178.0,41.0,178.0,compiler
2282,AutoLocalPrivilegeEscalation,ngalongc/AutoLocalPrivilegeEscalation,54310382.0,"An automated script that download potential exploit for linux kernel from exploitdb, and compile them automatically",Python,9.0,175.0,57.0,175.0,compiler
2284,whalesong,dyoo/whalesong,1197730.0,Whalesong: Racket to JavaScript compiler,Racket,11287.0,174.0,22.0,174.0,compiler
2285,ghc-android,neurocyte/ghc-android,8014510.0,Build scripts for building ghc cross compilers targeting Android,Shell,48.0,173.0,30.0,173.0,compiler
2288,FFmpeg-iOS,chrisballinger/FFmpeg-iOS,12769083.0,FFmpeg static libraries compiled for iOS,Ruby,41.0,171.0,79.0,171.0,compiler
2290,rust-phf,sfackler/rust-phf,15992970.0,Compile time static maps for Rust,Rust,2392.0,170.0,36.0,170.0,compiler
2295,CompileDaemon,githubnemo/CompileDaemon,5816240.0,Very simple compile daemon for Go,Go,49.0,169.0,27.0,169.0,compiler
2302,go-repl,vito/go-repl,404142.0,"A Go REPL. Builds up a source .go file over time, compiles it for output.",Go,190.0,163.0,22.0,163.0,compiler
2303,kramed,GitbookIO/kramed,22446549.0,A markdown (kramdown compatible) parser and compiler. Built for speed. (Fork of marked),HTML,566.0,161.0,33.0,161.0,compiler
2309,freepascal,graemeg/freepascal,247909.0,"Free Pascal Compiler - an open source Object Pascal compiler. This is an unofficial mirror of the FPC SubVersion repository and is for convenience use only. It is synced every 15 minutes. For submitting patches or bug reports, go to http://bugs.freepascal.org",Pascal,201472.0,156.0,64.0,156.0,compiler
2312,clang-ctags,drothlis/clang-ctags,5136197.0,"Generate tag file for C++ source code, using the clang C++ compiler's parsing libraries",Shell,275.0,155.0,18.0,155.0,compiler
2313,yscheme,yinwang0/yscheme,19650238.0,a compiler from Scheme into X64,Scheme,166.0,153.0,151.0,153.0,compiler
2321,compressJS.sh,dfsq/compressJS.sh,2399561.0,Build several javascript files into the one build file previously compressing them with Google Closure Compiler.,Shell,141.0,151.0,41.0,151.0,compiler
2324,ichbins,darius/ichbins,758885.0,A tiny self-hosting Lisp-to-C compiler,C,44.0,150.0,13.0,150.0,compiler
2327,compilers-targeting-c,dbohdan/compilers-targeting-c,49368478.0,A list of compilers that can generate C code,null,27.0,149.0,14.0,149.0,compiler
2329,vicare,marcomaggi/vicare,642259.0,A native compiler for Scheme compliant with R6RS,Scheme,247945.0,148.0,24.0,148.0,compiler
2330,rustw,nrc/rustw,54919602.0,A web frontend for the Rust compiler,Rust,753.0,148.0,9.0,148.0,compiler
2334,sklearn-compiledtrees,ajtulloch/sklearn-compiledtrees,17885881.0,Compiled Decision Trees for scikit-learn,Python,103.0,144.0,21.0,144.0,compiler
2337,django-libsass,torchbox/django-libsass,17447212.0,A django-compressor filter to compile SASS files using libsass,Python,26.0,142.0,19.0,142.0,compiler
2341,go-staticcheck,dominikh/go-staticcheck,55308508.0,"Staticcheck is a tool for statically checking the inputs to certain functions, such as regexp.Compile",Go,56.0,140.0,2.0,140.0,compiler
2343,js,akapav/js,567308.0,JavaScript compiler for Common Lisp,Common Lisp,469.0,139.0,20.0,139.0,compiler
2344,JsMinifier,cgutierrez/JsMinifier,3178934.0,Sublime Text plugin for javascript minification using Google Closure compiler,Python,128.0,139.0,21.0,139.0,compiler
2345,ffmpegc,lvjian700/ffmpegc,6823067.0,"Compile ffmpeg for iOS, support armv7s , armvs7 & i386 simulator",Shell,6103.0,139.0,94.0,139.0,compiler
2346,ruby-ejs,sstephenson/ruby-ejs,1762906.0,EJS (Embedded JavaScript) template compiler for Ruby,Ruby,119.0,138.0,42.0,138.0,compiler
2350,SDC,SDC-Developers/SDC,693617.0,The Stupid D Compiler,D,14541.0,137.0,43.0,137.0,compiler
2353,ultra-tiny-compiler,elfet/ultra-tiny-compiler,55230149.0,Ultra Tiny Compiler,CoffeeScript,6.0,136.0,10.0,136.0,compiler
2354,scala-clippy,softwaremill/scala-clippy,48295798.0,Good advice for Scala compiler errors,Scala,247.0,136.0,6.0,136.0,compiler
2355,MassiveUnit,massiveinteractive/MassiveUnit,1172675.0,"munit is a cross-platform unit testing framework for Haxe. Utilises metadata markup for test cases and includes tools for generating, compiling and running test cases from the command line.",Haxe,2325.0,136.0,44.0,136.0,compiler
2356,python-for-iphone,cobbal/python-for-iphone,908687.0,Build script for compiling python into a static library that can be used with the official SDK,Shell,222.0,136.0,20.0,136.0,compiler
2359,FSharp.Compiler.Service,fsharp/FSharp.Compiler.Service,13227260.0,The F# compiler as a component. For editors. For analyzers. For love. You know you want it.,F#,151836.0,133.0,80.0,133.0,compiler
2360,js2coffee.py,rstacruz/js2coffee.py,1463402.0,JS to CoffeeScript compiler. [DEPRECATED],Python,124.0,133.0,5.0,133.0,compiler
2362,mlworks,Ravenbrook/mlworks,9699558.0,MLWorks is a Standard ML compiler and development environment.,Standard ML,31631.0,132.0,12.0,132.0,compiler
2363,scheme-to-c,akeep/scheme-to-c,14435776.0,A small nanopass compiler from a subset of Scheme to C.  (Developed for Clojure Conj 2013),Scheme,196.0,131.0,17.0,131.0,compiler
2367,deadsimple-less-watch-compiler,jonycheung/deadsimple-less-watch-compiler,5892161.0,A nodejs script that allows you to watch a folder for changes and compile the less css files into another folder.,JavaScript,35.0,128.0,49.0,128.0,compiler
2370,boomlet,busterc/boomlet,14511045.0,"Bookmarklet compiler encloses, encodes, minifies your Javascript file and opens an HTML page with your new bookmarklet for immediate use.",JavaScript,80.0,128.0,3.0,128.0,compiler
2377,pytci,cheery/pytci,44389194.0,Python Compiler Infrastructure,Python,17.0,124.0,8.0,124.0,compiler
2379,turbopascal,lkesteloot/turbopascal,13640503.0,Web-based Turbo Pascal compiler.,JavaScript,162.0,123.0,21.0,123.0,compiler
2380,ceylon,ceylon/ceylon,46155527.0,"The Ceylon compiler, language module, and command line tools",Java,115856.0,123.0,34.0,123.0,compiler
2382,maud,lfairy/maud,28127585.0,:pencil: Compile-time HTML templates for Rust,Rust,821.0,123.0,11.0,123.0,compiler
2384,Website-Launch-Checklist-for-Web-Designers,tutsplus/Website-Launch-Checklist-for-Web-Designers,8601875.0,"At FHOKE we’ve been through it all, from perfect launches to ones that have turned into complete nightmares! Through our experiences we’ve compiled a list, in no particular order, of a process we go through before we launch our sites. http://webdesign.tutsplus.com/articles/workflow/a-web-designers-site-launch-checklist-including-portable-formats/ ‎",null,179.0,123.0,39.0,123.0,compiler
2395,idris-mode,idris-hackers/idris-mode,6729615.0,"Idris syntax highlighting, compiler-supported editing, interactive REPL and more things for Emacs.",Emacs Lisp,927.0,117.0,34.0,117.0,compiler
2398,trill,harlanhaskins/trill,66735738.0,"A simple, type safe, compiled language inspired by (and written in) Swift",Swift,388.0,116.0,2.0,116.0,compiler
2400,Vacietis,vsedach/Vacietis,1059768.0,C to Common Lisp compiler,Common Lisp,667.0,115.0,18.0,115.0,compiler
2404,X11RDP-o-Matic,scarygliders/X11RDP-o-Matic,7456525.0,"Currently for Debian-based distributions only, X11rdp-o-Matic automaticallydownloads, compiles, installs, and configures the X11rdp back-end X server , and the latest version of xrdp. RDPsesman is a menu driven utility for system administrators to configure local system users's RDP desktop environments. Will automatically install packages if necessary.",Shell,304.0,115.0,45.0,115.0,compiler
2405,grunt-contrib-jst,gruntjs/grunt-contrib-jst,5753559.0,Compile underscore templates to JST file.,JavaScript,157.0,114.0,47.0,114.0,compiler
2409,idris-erlang,lenary/idris-erlang,26605686.0,Erlang Backend for Idris Compiler,Erlang,502.0,111.0,6.0,111.0,compiler
2412,xproj,qfish/xproj,17104993.0,A shell script can batch adding compile flags like `-fno-objc-arc`or `-fobjc-arc` for all the files under the same dir by processing the project file.,Shell,259.0,111.0,31.0,111.0,compiler
2419,vim-arduino,tclem/vim-arduino,2468436.0,Compile and Deploy Arduino sketches in Vim,VimL,5514.0,108.0,15.0,108.0,compiler
2420,gulp-ng-html2js,marklagendijk/gulp-ng-html2js,15631510.0,Gulp plugin for compiling the HTML files of your Angular app to Javascript.,JavaScript,47.0,108.0,17.0,108.0,compiler
2423,fbc,freebasic/fbc,2458946.0,"FreeBASIC is a completely free, open-source, multi-platform BASIC compiler, with syntax similar to MS-QuickBASIC, that adds new features such as pointers, unsigned data types, inline assembly, object orientation, and many others.",Visual Basic,50877.0,107.0,32.0,107.0,compiler
2424,SingleCompile,xuhdev/SingleCompile,3000761.0,A Vim plugin making it more convenient to compile or run a single source file.,VimL,724.0,107.0,18.0,107.0,compiler
2426,build-raspbian-image,andrius/build-raspbian-image,9570184.0,Build (and cross-compile) your own image for Raspberry Pi,Shell,200.0,106.0,64.0,106.0,compiler
2429,intellij-java2smali,ollide/intellij-java2smali,16156708.0,A plugin for IntelliJ IDEA & Android Studio to easily compile Java & Kotlin files to smali.,Kotlin,7210.0,106.0,30.0,106.0,compiler
2430,tinyexpr,codeplea/tinyexpr,50113629.0,"tiny recursive descent expression parser, compiler, and evaluation engine for math expressions",C,109.0,105.0,6.0,105.0,compiler
2431,wclang,tpoechtrager/wclang,12624943.0,Cross compile source code easily for Windows with clang on Linux/Unix,C++,219.0,105.0,15.0,105.0,compiler
2434,Ahk2Exe,fincs/Ahk2Exe,2136168.0,Official AutoHotkey script compiler - written itself in AutoHotkey,AutoHotkey,175.0,104.0,28.0,104.0,compiler
