,name,full_name,id,description,language,size,watchers,forks,stargazers_count,group
9,vapor,vapor/vapor,49910095.0,A web framework and server for Swift that works on macOS and Ubuntu.,HTML,8901.0,5334.0,288.0,5334.0,web framework
11,Kitura,IBM-Swift/Kitura,51308720.0,A Swift Web Framework and HTTP Server,Swift,2217.0,4122.0,242.0,4122.0,web framework
13,iron,iron/iron,20702627.0,"An Extensible, Concurrent Web Framework for Rust",Rust,851.0,3317.0,241.0,3317.0,web framework
20,Swifton,necolt/Swifton,52214257.0,A Ruby on Rails inspired Web Framework for Swift that runs on Linux and OS X,Swift,139.0,1996.0,80.0,1996.0,web framework
22,mojo,kraih/mojo,65646.0,:sparkles: Mojolicious - Perl real-time web framework,Perl,28598.0,1740.0,410.0,1740.0,web framework
23,nickel.rs,nickel-org/nickel.rs,20462243.0,An expressjs inspired web framework for Rust,Rust,12680.0,1656.0,122.0,1656.0,web framework
28,lapis,leafo/lapis,6062770.0,A web framework for Lua and OpenResty written in MoonScript,MoonScript,2733.0,1337.0,132.0,1337.0,web framework
30,angular.dart,angular/angular.dart,9505974.0,A web framework for Dart,Dart,13450.0,1286.0,274.0,1286.0,web framework
36,kemal,sdogruyol/kemal,44826364.0,"Lightning Fast, Super Simple web framework for Crystal",Crystal,435.0,1033.0,60.0,1033.0,web framework
41,nitrogen,nitrogen/nitrogen,68626.0,Nitrogen Web Framework for Erlang (now with websockets!),Erlang,6009.0,796.0,146.0,796.0,web framework
47,sailor,sailorproject/sailor,15582132.0,A Lua MVC Web Framework.,Lua,2028.0,641.0,94.0,641.0,web framework
54,vanilla,idevz/vanilla,40606693.0,An OpenResty Lua MVC Web Framework,Lua,2412.0,513.0,142.0,513.0,web framework
55,phoenix-showdown,mroth/phoenix-showdown,22300494.0,:horse_racing: benchmark Sinatra-like web frameworks,Elixir,1274.0,508.0,58.0,508.0,web framework
57,traffic,pilu/traffic,12004328.0,Sinatra inspired regexp/pattern mux and web framework for Go,Go,149.0,486.0,19.0,486.0,web framework
58,blink,bixuehujin/blink,43488468.0,A high performance web framework and application server in PHP. ,PHP,227.0,472.0,65.0,472.0,web framework
64,learn-hapi,dwyl/learn-hapi,20352444.0,:sunny: Learn to use Hapi.js (Node.js) web framework to build scalable apps in less time,HTML,190.0,407.0,42.0,407.0,web framework
65,amethyst,Codcore/amethyst,36121102.0,Amethyst is a Rails inspired web-framework for Crystal language,Crystal,1474.0,395.0,29.0,395.0,web framework
68,jester,dom96/jester,4178258.0,A sinatra-like web framework for Nim.,Nimrod,229.0,382.0,41.0,382.0,web framework
70,itty,toastdriven/itty,144321.0,The itty-bitty Python web framework.,Python,225.0,375.0,47.0,375.0,web framework
72,weber,elixir-web/weber,12669962.0,[WiP] Web framework for Elixir inspired by Rails [#WeberMVC at freenode],Elixir,1052.0,371.0,39.0,371.0,web framework
77,sapper,sappworks/sapper,56665880.0,"A lightweight web framework built on async hyper, implemented in Rust language.",Rust,122.0,350.0,26.0,350.0,web framework
80,tako,mikeal/tako,3564777.0,Functional web framework.,JavaScript,206.0,334.0,18.0,334.0,web framework
85,framework,golangers/framework,5783199.0,Golanger Web Framework is a lightweight framework for writing web applications in Go.,Go,658.0,297.0,84.0,297.0,web framework
86,sugar,sugar-framework/sugar,15920083.0,Modular web framework for Elixir,Elixir,241.0,287.0,23.0,287.0,web framework
87,kara,TinyMission/kara,7249845.0,Kotlin Web Framework for the JVM,Kotlin,29932.0,286.0,54.0,286.0,web framework
88,koa.io,koajs/koa.io,25695632.0,Realtime web framework combine koa and socket.io.,JavaScript,89.0,280.0,41.0,280.0,web framework
89,neo,ivpusic/neo,30316179.0,Go Web Framework,Go,134.0,276.0,22.0,276.0,web framework
91,nyny,alisnic/nyny,10401753.0,a (ridiculously) small and powerful web framework.,Ruby,674.0,271.0,16.0,271.0,web framework
97,cobol-on-wheelchair,azac/cobol-on-wheelchair,15296644.0,Micro web-framework for COBOL,COBOL,70.0,254.0,7.0,254.0,web framework
98,Tir,mongrel2/Tir,1781184.0,A Simple Lua Web Framework For Mongrel2,Lua,446.0,253.0,28.0,253.0,web framework
99,moustache,cgrand/moustache,197728.0,a micro web framework/internal DSL to wire Ring handlers and middlewares,Clojure,159.0,252.0,9.0,252.0,web framework
102,goviz-frameworks,groob/goviz-frameworks,67243118.0,pretty pictures of web frameworks and applications,null,15393.0,229.0,18.0,229.0,web framework
105,rust-web-framework-comparison,flosse/rust-web-framework-comparison,40813887.0,A comparison of some web frameworks and libs written in Rust,Rust,61.0,224.0,13.0,224.0,web framework
108,bamboo,daogangtang/bamboo,1392303.0,"Bamboo is the web framework of Lua based on Mongrel2, ZeroMQ and NoSQL database.",Lua,5038.0,219.0,34.0,219.0,web framework
112,lor,sumory/lor,49632904.0,"a fast, minimalist web framework for lua based on OpenResty",Lua,224.0,212.0,36.0,212.0,web framework
115,IVORY,kanthvallampati/IVORY,6734082.0,"Simple, Flexible, & Powerful responsive web framework, Makes your web development faster and easier. It takes you all the way from 1200px on down to 320px. ",CSS,60.0,207.0,42.0,207.0,web framework
116,restas,archimag/restas,233418.0,Common Lisp web framework,Common Lisp,1019.0,202.0,49.0,202.0,web framework
119,moochine,appwilldev/moochine,3393947.0,"MOOCHINE - A simple and lightweight web framework based on OpenResty(ngx_lua, http://openresty.org).",Lua,578.0,193.0,61.0,193.0,web framework
120,pinot,ibdknox/pinot,2127264.0,the ClojureScript client-side web framework,Clojure,141.0,191.0,11.0,191.0,web framework
124,golf,dinever/golf,46426592.0,The Golf web framework :golf:,Go,194.0,180.0,11.0,180.0,web framework
125,kami,guregu/kami,29841963.0,"web ""framework"" with context",Go,97.0,177.0,20.0,177.0,web framework
130,albatross,kespindler/albatross,62277979.0,"A modern, fast, simple async python3 web framework",Python,87.0,167.0,10.0,167.0,web framework
132,erlyweb,yariv/erlyweb,59626.0,The Erlang twist on web frameworks,Erlang,680.0,161.0,26.0,161.0,web framework
133,pecan,stackforge/pecan,12088902.0,"A WSGI object-dispatching web framework, designed to be lean and fast with few dependencies.",null,2253.0,158.0,15.0,158.0,web framework
138,kibi,jed/kibi,2437749.0,"a client-side web framework in 1,024 bytes",JavaScript,141.0,150.0,11.0,150.0,web framework
141,PadrinoBook,wikimatze/PadrinoBook,2691235.0,The Guide To Master The Elegant Ruby Web Framework.,TeX,3959.0,145.0,30.0,145.0,web framework
143,frankie,deadprogram/frankie,7927.0,Easy creation of Facebook applications in Ruby using plugin for Sinatra web framework that integrates with Facebooker gem.,Ruby,86.0,142.0,22.0,142.0,web framework
145,ace,plimble/ace,27669616.0,Blazing fast Go Web Framework,Go,64.0,140.0,18.0,140.0,web framework
146,busker,pachacamac/busker,21734372.0,An extremely simple web framework.,Ruby,27.0,140.0,15.0,140.0,web framework
147,bottle-cork,FedericoCeratto/bottle-cork,3964172.0,Authentication module for the Bottle and Flask web frameworks,Python,809.0,139.0,83.0,139.0,web framework
151,golang-mux-benchmark,cypriss/golang-mux-benchmark,14865571.0,Performance shootout of popular Go mux/routers/middleware web frameworks,Go,232.0,129.0,15.0,129.0,web framework
152,Moonshine,dhruvrajvanshi/Moonshine,34553660.0,Web framework for Crystal language,Crystal,106.0,128.0,13.0,128.0,web framework
153,dubious,mirah/dubious,766975.0,A Web Framework Written in Mirah for running on AppEngine,Mirah,3958.0,126.0,16.0,126.0,web framework
155,spooky,flashingpumpkin/spooky,1919600.0,Minimum viable Erlang web framework,Erlang,218.0,122.0,8.0,122.0,web framework
156,lime,aheinze/lime,5664706.0,micro php web framework,PHP,60.0,121.0,14.0,121.0,web framework
163,amazium,OwlyStuff/amazium,5483088.0,The responsive CSS web framework,CSS,3103.0,113.0,45.0,113.0,web framework
167,wut4lunch_demos,ryansb/wut4lunch_demos,24819455.0,"Demos to accompany an article comparing the Flask, Django, and Pyramid web frameworks.",Python,191.0,110.0,48.0,110.0,web framework
168,php-phalcon-mamp,majksner/php-phalcon-mamp,11851779.0,Phalcon is a web framework implemented as a C extension offering high performance and lower resource consumption http://phalconphp.com/,null,22507.0,110.0,28.0,110.0,web framework
169,node-api-examples,caio-ribeiro-pereira/node-api-examples,62854182.0,A set of Node Tasklist APIs which explores some databases and web frameworks.,JavaScript,74.0,108.0,19.0,108.0,web framework
172,awesome-webframeworks,planetruby/awesome-webframeworks,38115409.0,"A collection of awesome Ruby web frameworks, libraries, tools, etc.",null,232.0,106.0,6.0,106.0,web framework
173,router,iron/router,20944780.0,Router middleware for the Iron web framework.,Rust,161.0,105.0,61.0,105.0,web framework
174,django-colorful,charettes/django-colorful,1236911.0,Extension to the Django web framework that provides database and form color fields,Python,76.0,105.0,49.0,105.0,web framework
176,jolla,salamer/jolla,56244790.0,Python Web Framework,Python,164.0,102.0,13.0,102.0,web framework
177,django-email-confirmation,jtauber-archive/django-email-confirmation,194813.0,simple email confirmation for the Django web framework,Python,184.0,102.0,89.0,102.0,web framework
178,graffiti,webdevwilson/graffiti,986056.0,Graffiti is a lightweight web framework for Groovy inspired by Sinatra,Groovy,6628.0,101.0,12.0,101.0,web framework
183,ufront,ufront/ufront,9787687.0,"Ufront is a powerful MVC web framework for Haxe. It gives you quick development, shared code on the client and server, powerful extensibility, easy testing, and targets PHP or Neko.  This is the mothership repo - most of the actual code is contained in the other ufront repos, such as ufront-mvc.",Shell,691.0,96.0,16.0,96.0,web framework
188,flancy,toenuff/flancy,45089457.0,A micro web framework for Windows PowerShell,PowerShell,835.0,88.0,15.0,88.0,web framework
189,orbit,keplerproject/orbit,313433.0,Orbit is an MVC web framework for Lua.,Lua,1543.0,87.0,29.0,87.0,web framework
191,oxidize,jroweboy/oxidize,15830030.0,A very basic web framework for Rust,Rust,2216.0,86.0,7.0,86.0,web framework
195,handlebars-iron,sunng87/handlebars-iron,28865900.0,Handlebars middleware for Iron web framework,Rust,753.0,84.0,21.0,84.0,web framework
196,lucerne,eudoxia0/lucerne,27279362.0,"A web framework for Common Lisp, built on Clack",Common Lisp,293.0,83.0,12.0,83.0,web framework
197,frost,ysbaddaden/frost,48559853.0,Full Featured Web Framework for the Crystal Programming Language,Crystal,248.0,83.0,6.0,83.0,web framework
205,dart-force,ForceUniverse/dart-force,15165938.0,Dart Realtime Web Framework!,Dart,3184.0,76.0,11.0,76.0,web framework
206,waffle,benglard/waffle,33100294.0,"Fast, asynchronous web framework for Lua/Torch",Lua,65.0,74.0,8.0,74.0,web framework
209,slickspeed,kamicane/slickspeed,133775.0,[dead] Speed / Validity test for css dom queries in JavaScript web Frameworks.,PHP,92.0,71.0,14.0,71.0,web framework
212,ofbiz-smart,huihoo/ofbiz-smart,36414890.0,"A tiny,smart,powerfull web framework inspired by OFBiz framework, Spring-Boot, Moqui",null,5326.0,68.0,40.0,68.0,web framework
218,espec_phoenix,antonmi/espec_phoenix,34621443.0,ESpec for Phoenix web framework.,Elixir,312.0,64.0,19.0,64.0,web framework
220,mre,erickt/mre,3946691.0,MRE: A web framework written in Rust,Rust,211.0,64.0,9.0,64.0,web framework
222,ashes,nickgartmann/ashes,29114802.0,A code generation tool for the Phoenix web framework,Elixir,302.0,62.0,7.0,62.0,web framework
225,giallo,kivra/giallo,8135750.0,Small and flexible web framework on top of Cowboy,Erlang,310.0,61.0,4.0,61.0,web framework
227,Slimane,noppoMan/Slimane,48130430.0,An express inspired web framework for swift that works on OSX and Ubuntu.,Swift,346.0,61.0,6.0,61.0,web framework
229,IdrisWeb,idris-hackers/IdrisWeb,10605512.0,"A secure web framework, built in the Idris language.",TeX,947.0,60.0,3.0,60.0,web framework
230,arachne-core,arachne-framework/arachne-core,62824861.0,The core module for the Arachne web framework,Clojure,96.0,60.0,4.0,60.0,web framework
233,fragmenta,fragmenta/fragmenta,39687459.0,"A command line tool for creating, running and deploying golang websites, part of the fragmenta go web framework",Go,72.0,59.0,7.0,59.0,web framework
237,iliad,NicolasPetton/iliad,298334.0,iliad smalltalk web framework,Smalltalk,6083.0,56.0,9.0,56.0,web framework
238,pycnic,nullism/pycnic,45515880.0,A JSON API web framework for lazy people.,Python,40.0,56.0,14.0,56.0,web framework
240,kelp,naturalist/kelp,9069839.0,"A web framework light, yet rich in nutrients.",Perl,871.0,55.0,14.0,55.0,web framework
244,django-bookmarks,brosner/django-bookmarks,177881.0,bookmark management for the Django web framework,null,117.0,53.0,27.0,53.0,web framework
245,backpacking,cdcarter/backpacking,334.0,An Io web framework of sorts,Io,33.0,53.0,5.0,53.0,web framework
246,cpfthw,5aket/cpfthw,4161594.0,http://www.blog.fruiapps.com/2012/05/Choose-your-Python-Web-Framework-the-Hard-Way,Python,207.0,53.0,48.0,53.0,web framework
247,baa,go-baa/baa,51890205.0,"an express Go web framework with routing, middleware, dependency injection, http context.",Go,158.0,53.0,11.0,53.0,web framework
250,base,agency/base,9595221.0,"An intelligent, developer-friendly responsive web framework.",CSS,1913.0,51.0,14.0,51.0,web framework
252,restish,ish/restish,99407.0,"Restish is a simple to use, lightweight WSGI web framework and library with a",,,,,,web framework
253,"strong focus on resources, request/response, URLs and content negotiation.",JavaScript,4657.0,51,10,51.0,,,,web framework
256,bleh,will123195/bleh,40213126.0,A web framework with automatic Browserify + Less + Express + Handlebars,JavaScript,110.0,50.0,1.0,50.0,web framework
260,compare-python-web-frameworks,mattmakai/compare-python-web-frameworks,40148362.0,Helping you select a Python web framework based on an example app.,Python,68.0,48.0,12.0,48.0,web framework
263,django-microblogging,skabber/django-microblogging,127544.0,  microblogging for the Django Web Framework  initially spun out of Pinax's zwitschern application,Python,100.0,48.0,17.0,48.0,web framework
265,web,masak/web,114854.0,A Perl 6 web framework,Perl,5194.0,47.0,7.0,47.0,web framework
266,pedestal-todo,konrad-garus/pedestal-todo,10107985.0,Client-side only TODO app written in Pedestal (Clojure web framework),Clojure,128.0,47.0,8.0,47.0,web framework
267,amatista,werner/amatista,34396476.0,Web Framework for Crystal http://crystal-lang.org,Crystal,116.0,47.0,4.0,47.0,web framework
270,tornroutes,nod/tornroutes,2493509.0,routes decorator for the Tornado web framework,Python,149.0,46.0,5.0,46.0,web framework
272,minitwit,eh3rrera/minitwit,41017433.0,"Based on Flask's MiniTwit example and written in Java with the Spark web framework, Spring, and HSQLDB",Java,132.0,46.0,47.0,46.0,web framework
273,node-bigpipe,xunuoi/node-bigpipe,48615388.0,"A lightweight Bigpie Module for Nodejs,  Express,  Sails, ThinkJS with good intergration for any web framework",JavaScript,60.0,46.0,3.0,46.0,web framework
274,q,kataras/q,65244924.0,HTTP/2 Web framework for Golang. Aims to be developer friendly. 100% compatible with net/http,Go,158.0,46.0,1.0,46.0,web framework
277,django-offline-messages,dym/django-offline-messages,1216974.0,Offline messages for Django Web Framework,Python,49.0,44.0,23.0,44.0,web framework
278,heroku-buildpack-shiny,btubbs/heroku-buildpack-shiny,14131824.0,"For deploying apps running on R's ""Shiny"" web framework",Shell,148.0,44.0,10.0,44.0,web framework
280,node.kt,jonninja/node.kt,8255594.0,A web framework built in Kotlin that is inspired by Node.js,Kotlin,614.0,44.0,6.0,44.0,web framework
282,merb-internals-handbook,michaelklishin/merb-internals-handbook,46826.0,"A guide through internals of Merb, very fast, flexible and modular web framework in Ruby",null,291.0,44.0,8.0,44.0,web framework
283,luv,artemshein/luv,87103.0,[abandoned] Lua MVC web-framework,Lua,1064.0,44.0,0.0,44.0,web framework
284,owl,owl-framework/owl,25516530.0,PHP Web framework powered by Zephir & delivered as a C-extension,Zephir,27861.0,44.0,3.0,44.0,web framework
287,owl,yeaha/owl,31196681.0,RESTful web framework,null,605.0,43.0,12.0,43.0,web framework
288,go-web-frameworks,hfeeki/go-web-frameworks,8945484.0,Some of go web frameworks I collected,null,128.0,43.0,5.0,43.0,web framework
289,webframeworks.kr,KoreaHTML5/webframeworks.kr,20315490.0,Web Framework / Library / Tool 정보와 튜토리얼을 제공하는 사이트용 저장소입니다.,HTML,29954.0,43.0,22.0,43.0,web framework
291,haxigniter,ciscoheat/haxigniter,317219.0,"A web framework for Haxe, superseded by ufront.",HaXe,2783.0,43.0,5.0,43.0,web framework
293,sinatra-ditties,foca/sinatra-ditties,45567.0,A series of plugins and useful helpers for the Sinatra web framework,Ruby,107.0,43.0,2.0,43.0,web framework
296,node-resthooksdemo,zapier/node-resthooksdemo,12352012.0,A simple node.js RESTHooks demo built upon the Sails Web Framework,JavaScript,246.0,42.0,3.0,42.0,web framework
297,django_gmapsfield,bocoup/django_gmapsfield,1194479.0,A Google Maps field type for the django web framework,JavaScript,169.0,41.0,10.0,41.0,web framework
303,kovert,kohesive/kovert,41204568.0,The invisible REST and web framework,Kotlin,423.0,40.0,3.0,40.0,web framework
307,ceylon-cayla,vietj/ceylon-cayla,11007446.0,A web framework for Ceylon,Ceylon,317.0,39.0,8.0,39.0,web framework
308,staticfile,iron/staticfile,25762279.0,Static file-serving middleware for the Iron web framework.,Rust,162.0,39.0,42.0,39.0,web framework
309,grails-cxf,Grails-Plugin-Consortium/grails-cxf,474954.0,CXF Plugin for the Grails web framework,Groovy,32954.0,39.0,39.0,39.0,web framework
310,flask-simpleldap,admiralobvious/flask-simpleldap,22800941.0,LDAP authentication extension for the Flask web framework,Python,80.0,39.0,11.0,39.0,web framework
311,rouille,tomaka/rouille,39148240.0,Web framework in Rust,Rust,3860.0,39.0,3.0,39.0,web framework
312,web.go,hoisie/web.go,3976091.0,web.go is a web framework in Go,null,100.0,39.0,7.0,39.0,web framework
313,weblit,creationix/weblit,31999048.0,A web framework for luvit 2.0 and lit,Lua,55.0,39.0,12.0,39.0,web framework
314,rawk,kisom/rawk,1315227.0,rage against web frameworks - posix shell static site generator,Groff,86.0,39.0,7.0,39.0,web framework
315,pyramid_mongodb,niallo/pyramid_mongodb,1774605.0,Basic Pyramid Scaffold to easily use MongoDB for persistence with the Pyramid Web framework,Python,193.0,39.0,12.0,39.0,web framework
316,carbon-crystal,benoist/carbon-crystal,43143830.0,Carbon Crystal - Web framework for Crystal Lang,Crystal,377.0,39.0,3.0,39.0,web framework
319,lunar,jasonlvhit/lunar,25725823.0,A Python Web Framework.,Python,161.0,38.0,6.0,38.0,web framework
321,sw,jroimartin/sw,16575048.0,sw is a minimal and sane web framework,Awk,11.0,38.0,3.0,38.0,web framework
323,phoenix-docker,marcelocg/phoenix-docker,33515973.0,A Docker container for the Phoenix Elixir web framework,null,17.0,37.0,27.0,37.0,web framework
324,awful,mario-goulart/awful,4197893.0,A web framework in CHICKEN Scheme,Scheme,581.0,36.0,4.0,36.0,web framework
327,Kunugi,novi/Kunugi,48944944.0,Minimal web framework and middleware for Swift,Swift,28.0,36.0,1.0,36.0,web framework
328,trinity,ruby-rdf/trinity,473648.0,[UNMAINTAINED] A minimalistic Ruby web framework for publishing Linked Data.,JavaScript,161.0,36.0,0.0,36.0,web framework
330,mnml,bradwright/mnml,129532.0,A lightweight Python web framework,Python,96.0,35.0,10.0,35.0,web framework
331,pyramid_redis_sessions,ericrasmussen/pyramid_redis_sessions,3909676.0,Pyramid web framework session factory backed by Redis,Python,230.0,35.0,17.0,35.0,web framework
333,allatpay-python,achimnol/allatpay-python,4723800.0,AllAtPay (online payments) API Library for Python and Some Examples for Django Web Framework,Python,109.0,35.0,12.0,35.0,web framework
334,bustard,mozillazg/bustard,33099268.0,A tiny WSGI web framework（一个玩具式的 WSGI Web 框架）(Python 3.5+ ).,Python,207.0,35.0,2.0,35.0,web framework
338,scotty-starter,scotty-web/scotty-starter,12752738.0,A starter-kit for the Scotty web framework,Haskell,201.0,34.0,7.0,34.0,web framework
340,purse,Phyramid/purse,19075706.0,"A modern web framework for PHP inspired by Sinatra (with routes, MVC, Jade and Stylus).",CSS,811.0,34.0,3.0,34.0,web framework
342,pwp,danghvu/pwp,7801462.0,Python Web framework P0wner,Python,125.0,33.0,4.0,33.0,web framework
343,lj-web,kindy/lj-web,7609219.0,lightweight web framework based on ngx_openresty,Lua,218.0,33.0,8.0,33.0,web framework
344,fresh,devinus/fresh,1055606.0,The freshest Erlang web framework,Erlang,727.0,33.0,3.0,33.0,web framework
346,padrino-assets,Cirex/padrino-assets,3161202.0,Plugin for the Padrino web framework which uses Sprockets to manage and compile assets,Ruby,226.0,33.0,11.0,33.0,web framework
347,kobin,c-bata/kobin,42408236.0,A statically-typed wsgi micro web-framework for Python3.,Python,151.0,33.0,4.0,33.0,web framework
348,spawn,soveran/spawn,24180.0,A ridiculously simple fixtures replacement for your web framework of choice.,Ruby,143.0,33.0,4.0,33.0,web framework
349,ginpprof,DeanThompson/ginpprof,26000507.0,A wrapper for golang web framework gin to use net/http/pprof easily.,Go,5.0,33.0,7.0,33.0,web framework
350,fixd,lantunes/fixd,11050125.0,"An HTTP Server Fixture for Testing HTTP Clients and mocking web services, and a Java Micro Web Framework",Java,230.0,33.0,4.0,33.0,web framework
353,django-firebird,maxirobaina/django-firebird,5129314.0,Firebird SQL backend for Django web framework,Python,195.0,32.0,19.0,32.0,web framework
355,swiplwebtut,Anniepoo/swiplwebtut,5594041.0,A tutorial for the swipl web framework,HTML,6567.0,32.0,11.0,32.0,web framework
356,django-mailer,brosner/django-mailer,165738.0,mail queuing and management for the Django web framework,Python,120.0,32.0,7.0,32.0,web framework
357,apex,infinitered/apex,20827215.0,Apex: the RubyMotion web framework for OS X.,Ruby,868.0,32.0,4.0,32.0,web framework
359,PythonAndDjango.sugar,atg/PythonAndDjango.sugar,420127.0,A sugar for both the Python programming language and the Django web framework.,null,332.0,32.0,5.0,32.0,web framework
360,valatra,erik/valatra,1997302.0,A Sinatra inspired web framework for Vala,Vala,115.0,32.0,2.0,32.0,web framework
362,WebFrameworkBenchmark,nanoant/WebFrameworkBenchmark,33822830.0,Benchmarking some web frameworks,Java,151.0,31.0,12.0,31.0,web framework
363,ronin,kprevas/ronin,1273324.0,Ronin web framework,Gosu,12595.0,31.0,10.0,31.0,web framework
365,spring-mvc-angular-js-hibernate-bootstrap-java-single-page-jwt-auth-rest-api-webapp-framework,ykameshrao/spring-mvc-angular-js-hibernate-bootstrap-java-single-page-jwt-auth-rest-api-webapp-framework,47799570.0,"This project provides sample hibernate entities, spring data entities, angularjs mvc code, models, exception handling interceptors, repositories, services and controllers classes. The UI for the default simple web project bundled in this framework is built using Twiiter Bootstrap and AngularJS Single Page App. The projects brings together Java, Spring 4, Spring MVC 4, Spring JPA, Hibernate, Angular JS, Twitter Bootstrap, JWT Token Authentication technology in a clean easy to use fashion.",Java,1597.0,31.0,23.0,31.0,web framework
366,lapis-chan,karai17/lapis-chan,50152232.0,Image board software written in Lua using the Lapis web framework.,Lua,406.0,31.0,8.0,31.0,web framework
368,Kenji,kballenegger/Kenji,3937217.0,A lightweight Ruby web framework.,Ruby,115.0,31.0,1.0,31.0,web framework
369,vuejs-python,italomaia/vuejs-python,50886227.0,"Examples showing how to use vuejs with python web frameworks (rest, websocket, etc)",Python,31.0,31.0,5.0,31.0,web framework
371,Quark,QuarkX/Quark,62730944.0,A clean web framework for modern Swift applications (macOS and Linux),Swift,1117.0,31.0,3.0,31.0,web framework
375,SingleLua,nly/SingleLua,43990551.0,Simple but powerful ngx_lua web framework,Lua,44.0,30.0,2.0,30.0,web framework
376,WebNano,zby/WebNano,451227.0,A really minimalistic web framework.,Perl,668.0,30.0,2.0,30.0,web framework
377,frodo,kn9ts/frodo,38623928.0,Frodo is a tiny Go web framework inspired by ExpressJS. -- ,Go,154.0,30.0,5.0,30.0,web framework
378,nitrogen_elements,vim-zz/nitrogen_elements,191499.0,Elements for Nitrogen Web Framework,Erlang,109.0,29.0,13.0,29.0,web framework
379,common,iron/common,21048130.0,"The core middleware, bundled, for the Iron web framework.",Rust,426.0,29.0,7.0,29.0,web framework
381,monsoon,benmerckx/monsoon,49820092.0,Minimal haxe web framework and embedded webserver,Haxe,246.0,29.0,1.0,29.0,web framework
382,picasso,adeel/picasso,1663285.0,A simple web framework built on Pump.,Python,128.0,29.0,0.0,29.0,web framework
383,ryan,pirj/ryan,74771.0,Web framework and a templating engine for Reia programming language.,Erlang,933.0,29.0,1.0,29.0,web framework
384,snail,moomerman/snail,68409.0,Snail is a web interface for Amazon Web Services (AWS) written using the sinatra web framework,JavaScript,125.0,29.0,2.0,29.0,web framework
386,flaskage,fgimian/flaskage,16665626.0,Flaskage is a complete and carefully designed template for use with the Flask web framework.,Python,342.0,28.0,3.0,28.0,web framework
387,history-of-web-frameworks-timeline,mraible/history-of-web-frameworks-timeline,529832.0,The history of web frameworks as described by a timeline of releases.,null,3180.0,27.0,4.0,27.0,web framework
388,safaia-framework,dsh0416/safaia-framework,41614733.0,Web Framework designed for cpp,C++,125.0,27.0,6.0,27.0,web framework
391,goji-boilerplate,hypebeast/goji-boilerplate,21320398.0,Project skeleton for Goji GoLang web framework with Bootstrap and Font Awesome.,Go,209.0,27.0,3.0,27.0,web framework
394,barista,steadicat/barista,663002.0,A client-side web framework for rich web sites and apps.,JavaScript,243.0,27.0,2.0,27.0,web framework
395,Swifton-TodoApp,necolt/Swifton-TodoApp,52214923.0,TodoApp example application built on top of Swifton web framework.,Swift,18.0,26.0,14.0,26.0,web framework
