,name,full_name,id,description,language,size,watchers,forks,stargazers_count,group
3861,coursera-ml005-unittests,cod3monk3y/coursera-ml005-unittests,18226886.0,Formal unit tests for Coursera Machine Learning ml-005,Matlab,457.0,7.0,8.0,7.0,machine learning
3863,simple-neural-network,jedborovik/simple-neural-network,51499639.0,Helper code for ForwardJS Machine Learning workshop,JavaScript,14.0,7.0,3.0,7.0,machine learning
3864,MLD,alistairwalsh/MLD,42342069.0,Machine Learning Lessons in OpenCV - development repo,Jupyter Notebook,25556.0,7.0,5.0,7.0,machine learning
3865,bottle_scikit_learn_web_services,ilknuricke/bottle_scikit_learn_web_services,20331712.0,creating machine learning web services using scikit_learn,null,1588.0,7.0,5.0,7.0,machine learning
3869,text_errata,astroML/text_errata,15948865.0,"A Catalog of errors and typos in the book ""Statistics, Data Mining, and Machine Learning in Astronomy",null,82.0,7.0,11.0,7.0,machine learning
3873,pykernels,gmum/pykernels,38014365.0,Python library for working with kernel methods in machine learning,Python,121.0,7.0,3.0,7.0,machine learning
3874,android-malware-analysis,mwleeds/android-malware-analysis,55439497.0,This project seeks to apply machine learning algorithms to android malware classification.,Python,9.0,7.0,4.0,7.0,machine learning
3875,cousera-ml,elyase/cousera-ml,9712022.0,Python port of the Coursera-Stanford Machine Learning Matlab code,Python,140.0,7.0,2.0,7.0,machine learning
3877,naive-bayes,timnugent/naive-bayes,16700173.0,"Naïve Bayes classifier with gaussian, multinomial and bernoulli decision rules [machine learning][statistics]",C++,144.0,7.0,5.0,7.0,machine learning
3878,BigData,zhangxiangxiao/BigData,8017505.0,Collalboration Hub for the NYU's Big Data: Large Scale Machine Learning course,Lua,469.0,7.0,6.0,7.0,machine learning
3882,opinion_miner_deluxe,cltl/opinion_miner_deluxe,15796295.0,Opinion miner based of Machine Learning that can be trained on a corpus of KAF/NAF files,Python,109.0,7.0,4.0,7.0,machine learning
3886,Rap_Lyric_Generator,llSourcell/Rap_Lyric_Generator,64081769.0,Rap Lyric Generator Demo for Fresh Machine Learning #4,Python,13.0,7.0,3.0,7.0,machine learning
3887,MLPlots.jl,JuliaML/MLPlots.jl,46578366.0,Plotting recipes for statistics and machine learning using Plots.jl,Julia,566.0,7.0,2.0,7.0,machine learning
3889,funq,psaris/funq,58210538.0,"Source files for ""Fun Q: A Functional Introduction to Machine Learning in Q""",null,55.0,7.0,3.0,7.0,machine learning
3890,ensembler,ClimbsRocks/ensembler,43966460.0,Automatically ensembles the predictions from different machine learning classifiers,JavaScript,94.0,7.0,2.0,7.0,machine learning
3892,hello_ml,rudrapoudel/hello_ml,30450241.0,Hello world examples of the Machine Learning algorithms.,Matlab,11279.0,7.0,2.0,7.0,machine learning
3895,tutorial-sklearn-lhcb,glouppe/tutorial-sklearn-lhcb,33745633.0,"Tutorial ""An introduction to Machine Learning with Scikit-Learn"", presented at CERN",null,2732.0,7.0,3.0,7.0,machine learning
3896,genre-wizard,acganesh/genre-wizard,27915998.0,A machine learning system to classify music genres from audio.,Python,236.0,7.0,1.0,7.0,machine learning
3900,viennaphp-predictionio,florianeckerstorfer/viennaphp-predictionio,23799687.0,Example of my presentation on Machine Learning with PredictionIO and PHP at ViennaPHP on 8 September 2014.,Shell,140.0,7.0,2.0,7.0,machine learning
3901,viennaphp-predictionio,florianeckerstorfer/viennaphp-predictionio,23799687.0,Example of my presentation on Machine Learning with PredictionIO and PHP at ViennaPHP on 8 September 2014.,Shell,140.0,7.0,2.0,7.0,machine learning
3902,shapeless-weka,vuspenskiy/shapeless-weka,32671057.0,Scala adapter for Weka machine learning library using shapeless,Scala,16.0,7.0,0.0,7.0,machine learning
3903,ios-KRGreyTheory,Kalvar/ios-KRGreyTheory,42063049.0,A predication method on machine learning especially in big data analysis.,Objective-C,37.0,7.0,0.0,7.0,machine learning
3904,collective.machinelearning,collective/collective.machinelearning,34808737.0,Machine learning for Plone: clustering and topic modeling using natural language processing.,Python,164.0,7.0,0.0,7.0,machine learning
3905,Helpme.jl,snotskie/Helpme.jl,20946746.0,"Provides the @helpme macro, a machine-learning based suggestion engine for your troubled code.",Julia,388.0,7.0,1.0,7.0,machine learning
3906,PLoS-Article-Classification,akud/PLoS-Article-Classification,2162059.0,Final project for Stats 132 at UC Berkeley; use machine learning algorithms to classify PLoS articles into subjects (accessing them via the SOLR API),Python,180.0,7.0,0.0,7.0,machine learning
3908,yelpData,emoreno619/yelpData,40143893.0,"This Node.js, Flask and PostgreSQL app models topics in Yelp reviews in order to succinctly display prominent topics for all reviews of a location. Users then better understand which features scores reflect. Scraped 1.1mil reviews in one day + 1.6mil from Yelp academic dataset. Data sci + machine learning + web application + D3 data viz. ",HTML,4333.0,7.0,2.0,7.0,machine learning
3912,MachineLearning,flashpixx/MachineLearning,8402441.0,"C++ framework that implements machinelearning algorithms (clustering, dimension reducing, genetic algorithms)",C++,5864.0,6.0,14.0,6.0,machine learning
3913,caret-machine-learning,tobigithub/caret-machine-learning,45488051.0,Practical examples for the R caret machine learning package,R,100.0,6.0,8.0,6.0,machine learning
3914,machine-learning,hsperr/machine-learning,34109285.0,Functions and helpers for ML,Python,22.0,6.0,4.0,6.0,machine learning
3915,machine_learning_techniques,hugobowne/machine_learning_techniques,19189024.0,In which I implement some applications of machine learning techniques.,Jupyter Notebook,8221.0,6.0,8.0,6.0,machine learning
3916,MachineLearning,apurva-sharma/MachineLearning,951487.0,,Python,136629.0,6.0,3.0,6.0,machine learning
3917,Machine-Learning--Perceptron,ptg180/Machine-Learning--Perceptron,2600022.0,Perceptron Algorithm Implementation,Python,95.0,6.0,4.0,6.0,machine learning
3918,Machine_Learning_Matlab,charlesxu90/Machine_Learning_Matlab,16878637.0,Matlab codes for Machine Learning algorithms. ,Matlab,5628.0,6.0,4.0,6.0,machine learning
3922,Machine-Learning,sasikanthkumar/Machine-Learning,42121213.0,,C++,8048.0,6.0,2.0,6.0,machine learning
3923,Machine-Learning-6.867-homework,peteflorence/Machine-Learning-6.867-homework,42822929.0,,Jupyter Notebook,56404.0,6.0,8.0,6.0,machine learning
3924,machinelearningintro,cambridgecoding/machinelearningintro,44985568.0,"boilerplate code, scripts, modules, data for Introduction to Machine Learning with Python",Jupyter Notebook,187.0,6.0,109.0,6.0,machine learning
3925,Large-Scale-Machine-Learning-With-Python,PacktPublishing/Large-Scale-Machine-Learning-With-Python,64469080.0,"Code repository for Large Scale Machine Learning with Python, published by Packt",Jupyter Notebook,2036.0,6.0,4.0,6.0,machine learning
3926,machine-learning-playground,kennethlynne/machine-learning-playground,23702153.0,Playing around with data,null,378.0,6.0,2.0,6.0,machine learning
3927,Machine-Learning-Stanford-University-Coursera,UtkarshPathrabe/Machine-Learning-Stanford-University-Coursera,24337611.0,Contains the Course Material and Assignment Solutions for the Machine Learning Course at Stanford University on Coursera. ,Matlab,22764.0,6.0,4.0,6.0,machine learning
3928,machine-learning-stanford,nastra/machine-learning-stanford,14845424.0,Stanford Machine Learning Class,Matlab,23088.0,6.0,2.0,6.0,machine learning
3929,Machine_Learning_Immunogenicity,NCBI-Hackathons/Machine_Learning_Immunogenicity,64324319.0,This is a repo for the Machine Learning Immunogenicity Team in the August 2016 NCBI Hackathon,Jupyter Notebook,125093.0,6.0,2.0,6.0,machine learning
3931,NgMachineLearningInR,rklancer/NgMachineLearningInR,1530565.0,"my R translation of exercises from Andrew Ng's online, Matlab-centric Machine Learning class",R,108.0,6.0,3.0,6.0,machine learning
3933,RustMachineLearning,MaikKlein/RustMachineLearning,11882870.0,test,Rust,148.0,6.0,0.0,6.0,machine learning
3935,machine_learning_recipes,cassiobotaro/machine_learning_recipes,56456895.0,":space_invader: Code developed in video series ""Machine Learning Recipes"", eventually with some personal comments and annotations.",Jupyter Notebook,225.0,6.0,1.0,6.0,machine learning
3936,ml2015,davidrosenberg/ml2015,29717365.0,Website for DS-GA 1003: Machine Learning and Computational Statistics,HTML,59149.0,6.0,14.0,6.0,machine learning
3938,ml_for_hackers,marcgg/ml_for_hackers,4845662.0,Machine Learning for Hackers,R,112307.0,6.0,3.0,6.0,machine learning
3940,ml-algorithms-simple,satojkovic/ml-algorithms-simple,3835836.0,A collection of machine learning algorithms in python,Python,105.0,6.0,5.0,6.0,machine learning
3941,IndiaHacksML,kartikmehta15/IndiaHacksML,50920220.0,Machine Learning Hackathon organized by Hackerearth,R,9.0,6.0,3.0,6.0,machine learning
3942,introduction_to_ml_with_spark,phatak-dev/introduction_to_ml_with_spark,41728152.0,Code and setup information for Introduction to Machine Learning with Spark,Scala,107.0,6.0,7.0,6.0,machine learning
3943,Fraud_Detector,kskk02/Fraud_Detector,21476617.0,"Fraud Detection using ensemble of Statistical, Network analysis and Machine learning approach. ",CSS,5656.0,6.0,6.0,6.0,machine learning
3944,Augmentor,mdbloice/Augmentor,52899913.0,Image augmentation library in Python for machine learning.,Python,99.0,6.0,3.0,6.0,machine learning
3945,learners,roderyc/learners,1693064.0,Machine learning algorithms written in scheme,Scheme,98.0,6.0,1.0,6.0,machine learning
3947,pigml,hanborq/pigml,10679590.0,An Apache Pig based machine learning pack for bigdata,Java,232.0,6.0,6.0,6.0,machine learning
3949,ASRDemos,danijel3/ASRDemos,48580708.0,Collection of machine learning demos for Automatic Speech Recognition,Jupyter Notebook,24476.0,6.0,5.0,6.0,machine learning
3952,ML-MOOC-NPTEL,Santara/ML-MOOC-NPTEL,59830704.0,This repository contains the Tutorials for the NPTEL MOOC on Machine Learning.,Jupyter Notebook,11846.0,6.0,3.0,6.0,machine learning
3953,niML,esafak/niML,22093436.0,Machine learning in nim,Nimrod,484.0,6.0,0.0,6.0,machine learning
3955,AzureML-R-Serialization,Quantia-Analytics/AzureML-R-Serialization,27043786.0,A tutorial with example code on serializing R objects in the Microsoft Azure Machine Learning Environment,R,168.0,6.0,7.0,6.0,machine learning
3957,practice,Ma-sa-ue/practice,54890126.0,programs about machine learning ,Jupyter Notebook,710119.0,6.0,0.0,6.0,machine learning
3960,JuliaML,serhanaya/JuliaML,43344709.0,Machine Learning Algorithms (Julia),Julia,40.0,6.0,0.0,6.0,machine learning
3961,Boosting,jardon-u/Boosting,3009068.0,Generic C++ Machine Learning Library,C++,193.0,6.0,0.0,6.0,machine learning
3962,PRML,wjgaas/PRML,30007150.0,pattern recognition and machine learning,null,342.0,6.0,0.0,6.0,machine learning
3963,ios-ML-Recommendation-System,Kalvar/ios-ML-Recommendation-System,41596782.0,Implemented Machine Learning on a Recommendation System demo sample.,Objective-C,81.0,6.0,2.0,6.0,machine learning
3964,mli,vadixidav/mli,44192876.0,Machine Learning Interface for Rust,Rust,33.0,6.0,0.0,6.0,machine learning
3965,genetic-algorithms,mdgart/genetic-algorithms,9551164.0,"Python port of ""Machine Learning: Introduction to Genetic Algorithms""",Python,135.0,6.0,3.0,6.0,machine learning
3966,scikit-learn-meetup,djsensei/scikit-learn-meetup,61246678.0,A dataset and notebook for demonstrating the power and simplicity of using scikit-learn for machine learning.,Jupyter Notebook,352.0,6.0,7.0,6.0,machine learning
3969,mlclass,fmarani/mlclass,2816498.0,Exercises from the Stanford machine learning class.,Matlab,29240.0,6.0,1.0,6.0,machine learning
3970,gpu-workshop-2016,berkeley-scf/gpu-workshop-2016,50209376.0,"Materials for workshop on GPU computation for statistics, data science, machine learning applications. ",HTML,4571.0,6.0,2.0,6.0,machine learning
3971,ml-sims,ProfessorBrunner/ml-sims,30669755.0,Machine Learning applied to Cosmological Simulations,TeX,308948.0,6.0,2.0,6.0,machine learning
3972,mlworkshop,morrislab/mlworkshop,58756613.0,Machine learning workshop presented at GLBIO 2016,Jupyter Notebook,25482.0,6.0,1.0,6.0,machine learning
3974,percipio,curiousily/percipio,30308005.0,"Easy Data science (Machine learning) in JavaScript & Node (Multi-armed bandits, Naive Bayes)",JavaScript,220.0,6.0,2.0,6.0,machine learning
3976,ZICA_ML,lucattelli/ZICA_ML,27598785.0,Z Instant Comprehensive ABAP - Machine Learning Library,ABAP,11900.0,6.0,0.0,6.0,machine learning
3977,awesome-ML,shashankg7/awesome-ML,58185890.0,Curated list of Machine Learning/Data Science resources,null,1.0,6.0,1.0,6.0,machine learning
3978,DataScience-Examples,pavank/DataScience-Examples,34064030.0,Practical Implementation of Machine Learning Algorithms on Open Datasets in R and Python,HTML,5654.0,6.0,2.0,6.0,machine learning
3980,coursera-ml-julia,homuler/coursera-ml-julia,47056116.0,Coursera Stanford Machine Learning course in Julia,Julia,19461.0,6.0,1.0,6.0,machine learning
3985,PowerShellAylien,dfinke/PowerShellAylien,25366201.0,"PowerShell Module to interact with AYLIEN Text Analysis API - a package consisting of eight different Natural Language Processing, Information Retrieval and Machine Learning APIs that can be adapted to your processes and applications with relative ease",PowerShell,440.0,6.0,7.0,6.0,machine learning
3987,spotifav,sdimi/spotifav,65100188.0,Map out your musical taste on Spotify with stats and machine learning,Jupyter Notebook,4878.0,6.0,1.0,6.0,machine learning
3988,ml-vm-notebook,paulovn/ml-vm-notebook,43304375.0,Machine Learning Virtual Machine (provisioned with Vagrant) for building Spark Notebook applications,Jupyter Notebook,770.0,6.0,2.0,6.0,machine learning
3989,mlpack-ios,Headtalk/mlpack-ios,18933438.0,Adopts mlpack machine learning as a project linkable in obj-c,C++,39508.0,6.0,1.0,6.0,machine learning
3990,clj-example-nlp-ml,plandes/clj-example-nlp-ml,64150438.0,Example Project for Natural Language Processing and Machine Learning Libraries,Clojure,81.0,6.0,0.0,6.0,machine learning
3991,DBScan,jessykate/DBScan,287740.0,Algorithms and other machine learning or data mining code,Python,71.0,6.0,1.0,6.0,machine learning
3993,rudra,Rudra-org/rudra,54786411.0,Distributed framework for large-scale machine learning with deep neural networks,X10,117.0,6.0,0.0,6.0,machine learning
3994,BRML.jl,taheris/BRML.jl,12544384.0,Julia translation for David Barber's Bayesian Reasoning and Machine Learning MATLAB toolbox,Matlab,418.0,6.0,1.0,6.0,machine learning
3996,FastForest,wangyi-fudan/FastForest,62428369.0,very fast machine learning with high accuracy based on oblique extreme random forest,null,1083.0,6.0,1.0,6.0,machine learning
3997,newspaper_elixir_phoenix_elm,archdragon/newspaper_elixir_phoenix_elm,57594323.0,"Use Machine Learning to generate a fake newspaper. Experiment with Elixir, Phoenix and Elm.",Elm,953.0,6.0,0.0,6.0,machine learning
4003,zulip,zulip/zulip,43160685.0,Zulip server - powerful open source group chat,Python,123428.0,4050.0,681.0,4050.0,chatting
4009,Chatto,badoo/Chatto,46873579.0,"A lightweight framework to build chat applications, made in Swift",Swift,2031.0,2282.0,244.0,2282.0,chatting
4010,Balloons.IO,rickyrauch/Balloons.IO,2320353.0,"Balloons.IO is a web multi-room chat server and client ready to use. It’s built with the help of node.JS, Express, Socket.IO and Redis. Balloons uses PassportJS for authentication with Twitter and Facebook",CSS,15751.0,2273.0,534.0,2273.0,chatting
4023,facebook-tunnel,matiasinsaurralde/facebook-tunnel,14995356.0,Tunneling Internet traffic over Facebook chat.,Groff,1983.0,1064.0,56.0,1064.0,chatting
4035,socket.io-android-chat,nkzawa/socket.io-android-chat,29067782.0,A simple chat demo for socket.io and Android,Java,151.0,713.0,303.0,713.0,chatting
4042,claudia-bot-builder,claudiajs/claudia-bot-builder,60166854.0,"Create chat bots for FB, Slack, Skype and Telegram and deploy to AWS Lambda in minutes",JavaScript,243.0,582.0,39.0,582.0,chatting
4046,vue-chat,Coffcer/vue-chat,41623844.0,chat example by vue.js + vuex + webpack,Vue,904.0,522.0,159.0,522.0,chatting
4049,ChatMessageView,himanshu-soni/ChatMessageView,42010332.0,Android library to create chat message view easily,Java,213.0,464.0,87.0,464.0,chatting
4051,cog,operable/cog,49292670.0,Bringing the power of the command line to chat,Elixir,2651.0,463.0,32.0,463.0,chatting
4053,gAES,nicolas-t/gAES,10139563.0,Encrypt your google chats and make the NSA sad,JavaScript,217.0,422.0,34.0,422.0,chatting
4056,convos,Nordaaker/convos,14822868.0,Better group chat,Perl,38267.0,410.0,33.0,410.0,chatting
4065,Uther,callmewhy/Uther,41310520.0,"Chat with the cute alien, help you make a memorandum!",Swift,9451.0,353.0,72.0,353.0,chatting
4068,NoChat,little2s/NoChat,60194742.0,A lightweight chat UI framework for iOS.,Swift,1923.0,341.0,17.0,341.0,chatting
4074,SwiftParseChat,huyouare/SwiftParseChat,31114110.0,"An Example iOS Chat Application with Parse, written in Swift",Swift,33091.0,294.0,74.0,294.0,chatting
4077,lambda-chat,cloudnative/lambda-chat,34355134.0,"A chat application without servers - using only AWS Lambda, S3, DynamoDB and SNS",HTML,318.0,268.0,42.0,268.0,chatting
4078,phpfreechat,kerphi/phpfreechat,936006.0,phpfreechat is a simple web based chat,CSS,7353.0,267.0,156.0,267.0,chatting
4079,nodejs-socketio-chat,plhwin/nodejs-socketio-chat,20517353.0,A simple chat demo by using Node.js and Socket.IO,CSS,24.0,266.0,226.0,266.0,chatting
4084,Chaty,LunarFlash/Chaty,51722642.0,"Anonymous chat app leveraging Google's Firebase, a NoSQL backend and WebSocket for real time data synching",Swift,28138.0,260.0,49.0,260.0,chatting
4085,chat,lzyy/chat,2651457.0,a live chat built with python(flask + gevent + apscheduler) + redis,Python,176.0,256.0,105.0,256.0,chatting
4091,PHPWebSocket-Chat,Flynsarmy/PHPWebSocket-Chat,3448862.0,Flexable and extensible WebSocket chat application example with a PHP server.,PHP,16.0,250.0,192.0,250.0,chatting
4093,blogChat,barretlee/blogChat,63919881.0,Chat room source code for Barret Lee's Personal Blog.,HTML,492.0,247.0,66.0,247.0,chatting
4094,slackcat,rlister/slackcat,17043270.0,Upload files to Slack chat from the command-line.,Ruby,35.0,241.0,18.0,241.0,chatting
4095,webrtc.io-demo,webRTC-io/webrtc.io-demo,5247794.0,webrtc.io multi user chat demo. Highly experimental technology,JavaScript,248.0,240.0,265.0,240.0,chatting
4098,SimpleChat,LoganWright/SimpleChat,17854972.0,An Easy To Use Bubble Chat Interface ,Swift,390.0,235.0,60.0,235.0,chatting
4105,hal,danryan/hal,21109642.0,A chat bot in Go.,Go,160.0,214.0,21.0,214.0,chatting
4106,OpenTokRTC,opentok/OpenTokRTC,13874438.0,WebRTC Demo using OpenTok's WebRTC library for video and OpenTok signaling for live chat,CSS,4506.0,214.0,107.0,214.0,chatting
4116,meteor-chat-tutorial,sebdah/meteor-chat-tutorial,11468106.0,Example Meteor chat application supporting GitHub authentication.,JavaScript,155.0,190.0,45.0,190.0,chatting
4117,Ybot,OtpChatBot/Ybot,7576377.0,Ybot - is a helpful chat robot written with Erlang which supports different messaging protocols. [@0xAX],Erlang,1847.0,190.0,39.0,190.0,chatting
4121,slackbot,trinchan/slackbot,16939767.0,"Simple, pluggable bot framework for Slack chat.",Go,171.0,187.0,37.0,187.0,chatting
4124,deadchat,jeztek/deadchat,10837329.0,group chat with end-to-end encryption,Python,238.0,183.0,16.0,183.0,chatting
4127,chatter,bocoup/chatter,57911407.0,A collection of useful primitives for creating interactive chat bots.,JavaScript,187.0,175.0,6.0,175.0,chatting
4131,zabbix-slack-alertscript,ericoc/zabbix-slack-alertscript,15479462.0,Zabbix AlertScript for Slack.com chat,Shell,72.0,170.0,53.0,170.0,chatting
4132,rethinkdb-example-nodejs-chat,rethinkdb/rethinkdb-example-nodejs-chat,7696840.0,A node.js chat application running on rethinkdb,CSS,1244.0,167.0,62.0,167.0,chatting
4134,chat,tegioz/chat,6013898.0,"Simple Chat built with Node.js, Socket.io, Express & Redis (+ client built with Bootstrap)",JavaScript,171.0,162.0,103.0,162.0,chatting
4136,hapi-socketio-redis-chat-example,dwyl/hapi-socketio-redis-chat-example,38606647.0,:speech_balloon: Real-time Chat using Hapi.js + Socket.io + Redis Pub/Sub (example + tests!!),JavaScript,113.0,161.0,44.0,161.0,chatting
4144,Node.js-Chat,geekuillaume/Node.js-Chat,4054135.0,"A good-looking Node.js + Socket.io chat application, built with Bootstrap and other beautiful libs. Totally commented.",CSS,216.0,148.0,143.0,148.0,chatting
4146,Rocket.Chat.iOS,RocketChat/Rocket.Chat.iOS,40144228.0,Rocket.Chat Native iOS Application,Swift,2426.0,145.0,60.0,145.0,chatting
4148,victor,brettbuddin/victor,4540472.0,Chat bots in Go (unmaintained),Go,228.0,144.0,29.0,144.0,chatting
4154,brutal,Netflix/brutal,9533057.0,A multi-network asynchronous chat bot framework using twisted,Python,112.0,137.0,33.0,137.0,chatting
4155,BubbleControl-Swift,cemolcay/BubbleControl-Swift,27880117.0,a bubble control highly inspired from facebook chat heads. written in swift,Swift,610.0,137.0,24.0,137.0,chatting
4159,chatjs,andrerpena/chatjs,24029242.0,Platform-independent jQuery plugin for chatting,TypeScript,175.0,133.0,77.0,133.0,chatting
4163,Telegram-Site-Helper-2.0,Surzhikov/Telegram-Site-Helper-2.0,58129837.0,Little chat (based on Telegram BOT platform) for creating web site helper,PHP,230.0,130.0,26.0,130.0,chatting
4164,rust-chat,nbaksalyar/rust-chat,38826700.0,"Simple chat service written in Rust, from scratch",Rust,40.0,128.0,22.0,128.0,chatting
4165,hubot-rocketchat,RocketChat/hubot-rocketchat,36918949.0,Rocket.Chat Hubot adapter,CoffeeScript,155.0,127.0,75.0,127.0,chatting
4169,redux-saga-chat-example,kuy/redux-saga-chat-example,57904867.0,A chat app built with redux-saga and Socket.IO.,JavaScript,11.0,124.0,14.0,124.0,chatting
4172,paper-chat,pubnub/paper-chat,28701818.0,A simple chat room in Material Design build with Polymer (Polymer 0.5),HTML,1352.0,122.0,54.0,122.0,chatting
4174,FBMessageScraper,RaghavSood/FBMessageScraper,24599772.0,A python script to download facebook chats,Python,238.0,119.0,34.0,119.0,chatting
4176,angular-bootstrap-simple-chat,irontec/angular-bootstrap-simple-chat,28599815.0,Simple AngularJS Chat Directive with Bootstrap,CSS,89.0,117.0,66.0,117.0,chatting
4177,how_to_build_your_own_team_chat_in_five_days,fdietz/how_to_build_your_own_team_chat_in_five_days,33870828.0,How to build your own team chat in five days blog series code ,CSS,1169.0,117.0,88.0,117.0,chatting
4179,psitsmike_example_2,mmukhin/psitsmike_example_2,2648774.0,node.js and socket.io multiroom chat tutorial,JavaScript,132.0,114.0,76.0,114.0,chatting
4183,chat.io,DanielBaulig/chat.io,3773728.0,A simple chat solution build on socket.io,JavaScript,213.0,112.0,29.0,112.0,chatting
4184,telegram-history-dump,tvdstaaij/telegram-history-dump,44500093.0,Backup Telegram chat logs using telegram-cli,Ruby,111.0,111.0,23.0,111.0,chatting
4185,chat,jkbrzt/chat,3391997.0,"A simple chat app created to experiment with Redis, Gevent, Flask & Server-Sent Events.  ",Python,105.0,110.0,29.0,110.0,chatting
4187,mini-chatter,DamirSvrtan/mini-chatter,19129301.0,100-lines of code Rack Chat App,Ruby,139.0,106.0,11.0,106.0,chatting
4191,vidchat,nulltask/vidchat,3358728.0,Experimental browser based video chat implementation with Node + Socket.IO + WebRTC. (Still in progress!),JavaScript,108.0,102.0,44.0,102.0,chatting
4197,reichat,kanreisa/reichat,29478608.0,A lovely paint chat application like a PaintChatApp built with Node.,JavaScript,162.0,99.0,11.0,99.0,chatting
4198,SImple-Chat-Server,mlakkadshaw/SImple-Chat-Server,4461470.0,Simple Chat Server using node.js with multiple dynamic rooms,JavaScript,222.0,97.0,16.0,97.0,chatting
4204,uberchat,joshmarshall/uberchat,1750060.0,Just a little Node.JS chat room creator.,JavaScript,142.0,93.0,30.0,93.0,chatting
4205,angular-socketio-chat,krimple/angular-socketio-chat,18844860.0,"A chat application written in AngularJS, Socket.IO, Node/Express and Bootstrap.  Feel free to fork/experiment.",ApacheConf,2874.0,93.0,94.0,93.0,chatting
4209,DiscordBot,chalda/DiscordBot,43721925.0,A chat bot for discord app based off discord.js,JavaScript,168.0,92.0,84.0,92.0,chatting
4211,simple-webrtc-video-chat,keithnorm/simple-webrtc-video-chat,7594978.0,A bare bones WebRTC video chat implementation ,JavaScript,191.0,91.0,44.0,91.0,chatting
4212,RouletteTok,jonmumm/RouletteTok,1896909.0,"Chat roulette using Node.js, Socket.io, and OpenTok",JavaScript,152.0,91.0,21.0,91.0,chatting
4216,ws42-chat,themgt/ws42-chat,8700244.0,Demo realtime chat with Rails 4 + Ruby 2 + WebSockets,Ruby,108.0,89.0,65.0,89.0,chatting
4221,Flask-SocketIO-Chat,miguelgrinberg/Flask-SocketIO-Chat,20952634.0,A simple chat application that demonstrates how to structure a Flask-SocketIO application.,Python,9.0,86.0,39.0,86.0,chatting
4223,fbchat,carpedm20/fbchat,34165498.0,Facebook Chat (Messenger) for Python,Python,54.0,85.0,34.0,85.0,chatting
4227,PyPunchP2P,laike9m/PyPunchP2P,17889262.0,Python实现NAT穿透+STUN+TURN+P2P聊天 | Python P2P chat,Python,23.0,80.0,61.0,80.0,chatting
4228,relay-chat,transedward/relay-chat,40604380.0,an chat example showing Relay with routing and pagination,JavaScript,190.0,80.0,9.0,80.0,chatting
4229,cockatoo,novelys/cockatoo,617648.0,Cockatoo is a simple chat server coded with EventMachine and using the Long Polling technique,JavaScript,140.0,80.0,3.0,80.0,chatting
4230,simplechat,zquestz/simplechat,5200319.0,Simple chat client written in meteor,JavaScript,218.0,79.0,13.0,79.0,chatting
4231,songroll-sky,ReneMoraales/songroll-sky,22399008.0,Meteor experiment. Real-time video playlists. Watch together and chat. ,CSS,2533.0,79.0,26.0,79.0,chatting
4234,mean-chat,DaftMonk/mean-chat,16680056.0,"Simple Chat app using Socket.IO, MongoDB, Express, Angular, and NodeJS.",JavaScript,183.0,78.0,52.0,78.0,chatting
4235,MessageBox-olde,b3ll/MessageBox-olde,9705772.0,Chat Heads everywhere in iOS!,Objective-C,4304.0,78.0,11.0,78.0,chatting
